review,rating
"O celular possui um bom sistema de gerenciamento de aplicativos em segundo plano, sem consumir muita bateria.",3
"Não consegui utilizá-lo como esperava, fiquei decepcionado.",2
"Um celular que me oferece tudo o que preciso e muito mais.",5
"A função de gravação de vídeo é estável e sem interrupções, ideal para gravações longas.",5
"A funcionalidade de gerenciamento de notificações de e-mails é eficiente, mas poderia ser mais organizada.",3
"A tela curva oferece uma experiência imersiva.",4
"O som estéreo melhora muito a experiência em músicas e filmes.",5
"Se eu soubesse que era vagabundo assim, nem tinha comprado!",1
"Entrega muito rápida e produto funcionando perfeitamente.",5
"O celular suporta bem a execução de múltiplos aplicativos de produtividade sem grandes problemas de lentidão.",2
"A qualidade surpreendeu, valeu cada centavo.",5
"A navegação na internet é rápida e sem interrupções.",5
"Recebi no prazo e estou muito satisfeito com o desempenho.",5
"As atualizações de software melhoraram algumas funcionalidades.",3
"A conectividade 5G é muito rápida, perfeito para streaming.",5
"O preço é justo pelo que o aparelho oferece.",3
"Não consigo conectar acessórios Bluetooth, falha constante.",1
"O celular mantém as atualizações automáticas sem falhas.",5
"Design moderno, mas o aparelho é um pouco pesado.",3
"Produto ótimo, adorei!",4
"A qualidade das transmissões de áudio durante as chamadas é muito baixa e com interferências constantes.",1
"A resistência à água é inexistente, danificou-se com pouca umidade.",1
"Não suporta carregamento rápido com cabos genéricos, o que é frustrante.",3
"A qualidade é incrível, mas o manual poderia ser mais claro.",4
"O celular mantém a estabilidade durante o uso prolongado de aplicativos de mapas.",4
"Entrega horrível, nunca mais compro dessa loja.",1
"A funcionalidade de câmera frontal é aceitável para selfies.",3
"O celular mantém a estabilidade durante longas sessões de uso.",3
"O celular lida bem com a navegação em aplicativos de notícias.",3
"O celular possui armazenamento expansível, o que é extremamente útil para mim.",5
"A leitura da digital é rápida e precisa.",4
"O slot para cartão SD não funciona.",1
"Memória insuficiente para instalar os aplicativos que preciso.",1
"A função Always-On Display é prática e bonita.",5
"A câmera traseira é incrível, ótima para fotos noturnas.",5
"A qualidade do som durante a reprodução de mídia é satisfatória.",3
"O aparelho possui um modo de economia de bateria eficiente, mas limita algumas funcionalidades.",3
"Ótimo para multitarefa, sem travamentos.",5
"O suporte para acessórios é limitado e pouco variado.",2
"A função de gravação em câmera lenta é impressionante.",5
"Satisfeito até agora. Vou testar mais aplicativos.",3
"O celular suporta a reprodução de mídias em alta definição sem nenhum problema de qualidade.",5
"O celular veio com película instalada, uma ótima surpresa.",5
"A personalização das configurações é ampla e fácil de ajustar.",4
"A qualidade da câmera do celular é muito ruim em ambientes com luz natural.",1
"A qualidade da câmera em fotos com movimento rápido é aceitável para uso casual.",3
"Serviço demorado, uma escolha terrível.",2
"Fiquei frustrado com o desempenho do dispositivo.",2
"Foi uma experiência incrível porque a qualidade é excelente.",5
"O touch screen para de responder de repente.",1
"Não funcionou com meu equipamento, tive que devolver.",1
"A bateria demora um pouco para carregar, mas dura o dia inteiro.",4
"O aparelho mantém a integridade dos dados durante o uso de aplicativos de armazenamento em nuvem, sem grandes problemas.",3
"O aparelho suporta bem a execução de aplicativos de comunicação em tempo real sem interrupções.",4
"A sincronização com serviços de nuvem é rápida e sem complicações.",5
"O celular possui um modo noturno que melhora a qualidade das fotos em ambientes com pouca luz.",4
"O armazenamento interno é suficiente para minhas necessidades.",3
"O aparelho suporta bem a edição de fotos com aplicativos básicos.",3
"A função de economia de bateria funciona bem.",3
"A qualidade do som é péssima, difícil ouvir chamadas.",1
"O aparelho possui um sistema de segurança eficaz integrado.",4
"Dei de presente para o meu pai e ele adorou!",4
"A resposta ao toque na tela é rápida e precisa.",5
"O celular não carrega.",1
"O celular superaquece em jogos mais pesados.",2
"Um aparelho que entrega tudo o que promete e um pouco mais.",5
"A qualidade é incrível, recomendo muito.",4
"O som dos alto-falantes não é muito alto, mas é claro.",4
"Maravilhoso e barato!",5
"O celular não vem com acessórios essenciais, deixando o usuário na mão.",1
"A bateria demora um pouco para carregar, mas dura bastante.",4
"Pelo valor, até que é bom, mas nada demais.",3
"O aparelho possui um bom equilíbrio entre performance e durabilidade.",3
"A interface de usuário é limpa e sem aplicativos desnecessários.",5
"O aparelho vem com muitos aplicativos pré-instalados que não podem ser removidos.",1
"A conectividade com Wi-Fi e Bluetooth funciona, mas pode ser instável ocasionalmente.",2
"Podia ser bem melhor, mas o sistema operacional não atualiza mais de versão.",2
"O celular oferece recursos avançados que realmente facilitam meu dia a dia.",5
"As notificações aparecem de forma clara e organizada.",5
"Produto chegou danificado, experiência frustrante.",1
"Bem mediano. Funções básicas e nada além disso.",3
"O celular não consegue executar tarefas básicas sem travamentos ou falhas frequentes, tornando-o inutilizável.",1
"O produto cumpre bem sua proposta, nada de excepcional.",4
"Não gostei, esperava algo mais intuitivo.",2
"Senti falta de algumas funcionalidades avançadas que mencionei na descrição.",3
"A capa traseira risca só de olhar.",1
"O sistema de notificações é bem organizado, fácil de acessar.",5
"O telefone tem muito pouco espaço para armazenamento adicional.",1
"Não recomendo, o aparelho apresentou muitos problemas.",1
"O aparelho possui um bom equilíbrio entre design elegante e funcionalidade prática, agradando tanto no visual quanto no uso diário.",2
"Chegou danificado, mas consegui trocar sem problemas.",4
"Considerando o preço, este celular oferece um bom conjunto de recursos.",4
"Entrega rápida e embalagem impecável, produto ótimo.",5
"A resistência à água é inexistente, danifiquei facilmente.",1
"O aparelho suporta bem a execução de aplicativos de entretenimento sem lentidão.",3
"O celular esquenta muito durante carregamento rápido.",3
"Não suporta alguns aplicativos mais antigos que eu uso.",2
"Fiquei muito feliz com a compra, o celular é muito bom!",5
"A função de backup automático é útil e funciona bem.",3
"O celular não consegue manter a conexão com redes móveis estáveis.",1
"O celular suporta bem a execução de múltiplos aplicativos de produtividade sem lentidão.",4
"A funcionalidade de backup automático protege meus dados de forma eficiente, mas poderia ser mais rápida.",3
"O sistema de notificações é muito bem organizado.",5
"A qualidade do som nos alto-falantes é ótima, mesmo em volumes altos.",5
"Ótimo custo-benefício, recomendo para quem busca um aparelho básico.",5
"Preço acessível para um produto que entrega o que promete.",4
"O celular trava ao tentar abrir aplicativos básicos.",1
"O carregamento sem fio é rápido e prático.",4
"O celular é leve e fácil de manusear.",3
"O celular lida bem com multitarefa leve.",3
"O celular é muito leve e confortável de segurar.",4
"Não atendeu às minhas expectativas, esperava mais.",2
"A câmera não tira fotos nítidas, as imagens ficam sempre borradas.",1
"O aparelho mantém a temperatura estável na maioria das vezes, mas pode esquentar com uso prolongado.",2
"A interface da câmera oferece múltiplas opções de configuração úteis.",4
"Achei um celular bem comum, não se destaca em nenhum aspecto.",2
"O aparelho não suporta a instalação de aplicativos populares sem apresentar falhas constantes e travamentos.",1
"A qualidade da câmera em fotos noturnas é aceitável para uso casual, capturando detalhes suficientes em ambientes com pouca iluminação e permitindo que eu registre momentos mesmo em condições desafiadoras de iluminação.",3
"A interface do celular é extremamente lenta para carregar aplicativos e responder aos toques, tornando o uso diário frustrante e ineficiente para o usuário.",1
"O aparelho não vem com fones de ouvido na caixa.",3
"O design é feio e desconfortável de segurar por longos períodos.",1
"O suporte ao cliente é eficiente e prestativo.",4
"A qualidade das transmissões de áudio em plataformas de comunicação é clara e sem falhas técnicas.",3
"A qualidade da tela para leitura de e-books é confortável e sem cansaço visual.",5
"O celular suporta bem as chamadas em conferência.",3
"Produto funciona, mas o design não é atrativo.",3
"O telefone apresenta lentidão ao alternar entre aplicativos.",1
"Gostei do modo de leitura, ótimo para usar à noite.",5
"Estou muito satisfeito, a qualidade supera as expectativas.",5
"O celular mantém a estabilidade durante o uso prolongado de aplicativos de mapas, mas pode apresentar pequenos atrasos.",3
"Produto superou minhas expectativas, qualidade incrível.",5
"A função de hotspot funciona de forma estável.",3
"O celular mantém a estabilidade durante uso de aplicativos de streaming de música.",3
"Atendimento ruim, não voltarei a comprar.",1
"Produto muito funcional, perfeito para o dia a dia.",5
"O aparelho tem um bom sistema de gerenciamento de energia.",3
"Demorou para chegar e não veio como o anunciado.",1
"O celular mantém a conectividade estável durante chamadas de conferência em aplicativos de comunicação, facilitando reuniões.",2
"A qualidade da tela para edição de documentos é adequada.",3
"A interface é intuitiva e fácil de usar.",4
"O celular não consegue manter a conexão com dispositivos Bluetooth de forma estável.",1
"O celular possui um sistema de gerenciamento de arquivos eficiente.",4
"O GPS é impreciso e nunca funciona corretamente.",1
"A câmera frontal não funciona direito para selfies.",1
"É um celular honesto, cumpre o que promete.",3
"A conectividade 5G é ultrarrápida, permitindo downloads e uploads em segundos.",5
"A funcionalidade de atualização automática de aplicativos é eficiente e sem erros, garantindo que meus aplicativos estejam sempre atualizados.",3
"O celular é confiável, mas não se destaca no mercado.",3
"Compre quando abaixaram o preço e não me arrependi!",4
"O suporte técnico demorou para responder, mas resolveu o problema.",3
"Não atende às especificações descritas, fiquei decepcionado.",2
"Produto de baixa qualidade, muito decepcionado.",1
"Recebi um produto com defeito, experiência frustrante.",1
"O desempenho é ótimo, uso todos os dias.",5
"Não gostei porque a qualidade é muito baixa.",1
"O celular é o melhor que já tive.",5
"O celular suporta bem a execução de múltiplos aplicativos de produtividade sem nenhuma lentidão.",5
"O preço é justo pela qualidade oferecida, recomendo.",4
"Produto simples e funcional, ideal para quem busca o básico.",4
"A resistência à água e poeira proporciona mais segurança no uso diário.",5
"O aparelho desligou e não liga mais.",1
"O aparelho não apresenta travamentos frequentes.",3
"Durabilidade da bateria deixou a desejar, descarrega rápido.",2
"Produto excelente, já comprei mais de um.",5
"A funcionalidade de agendamento de tarefas é útil e eficiente.",3
"A atualização do sistema causou mais problemas do que soluções.",1
"O atendimento foi ótimo, mas o produto não me impressionou.",3
"O desbloqueio facial é um pouco lento às vezes.",3
"A câmera ultra-wide captura imagens incríveis.",5
"O processador é potente, mas consome muita bateria.",3
"Leve e resistente! Gostei bastante!",4
"Não gostei do tamanho, é muito grande para segurar com uma mão.",3
"A câmera do celular não funciona bem em ambientes com pouca luz.",1
"Gostei da opção de personalizar a interface com temas e cores.",5
"A entrega atrasou e o produto veio com arranhões.",2
"O celular veio com um fone de ouvido de brinde.",4
"O aparelho tem muitas funcionalidades, mas o manual não é claro.",3
"O celular é um sucesso de vendas.",4
"A qualidade das transmissões de vídeo ao vivo é impecável.",5
"A funcionalidade do assistente de voz responde com precisão.",4
"A qualidade da câmera em vídeos gravados é satisfatória para uso diário, capturando imagens claras e sem interrupções.",3
"Entrega superou minhas expectativas, chegou antes do previsto.",5
"A tela é brilhante e clara mesmo sob luz direta do sol.",5
"A qualidade das chamadas de voz é cristalina, sem ruídos indesejados.",5
"A qualidade das transmissões de vídeo ao vivo em plataformas de streaming é satisfatória.",3
"O celular lida bem com a execução de aplicativos de produtividade sem apresentar lentidão.",4
"O celular tem um design ergonômico que facilita o uso com uma mão.",4
"A qualidade da câmera em ambientes com baixa luz é impressionante.",5
"A tela parou de funcionar após poucos dias de uso.",1
"O espaço de armazenamento é excelente, não precisei de cartão extra.",5
"A estabilização óptica de imagem garante fotos e vídeos nítidos mesmo em movimento.",4
"A funcionalidade de gravar a tela é muito prática.",5
"Fácil de montar, estou muito satisfeito com a compra.",5
"Excelente custo-benefício. Recomendo a todos!",5
"A qualidade da reprodução de vídeos em alta definição é excelente.",4
"A interface gráfica do celular é muito confusa, desorganizada e difícil de navegar, tornando o uso diário frustrante.",1
"A facilidade de instalação de aplicativos é ótima e sem complicações.",4
"A vibração é muito fraca, quase não sinto quando recebo notificações.",2
"O celular é resistente à água, o que me dá mais segurança.",4
"Um celular simples, mas eficiente para o dia a dia.",3
"O celular lida bem com a execução de múltiplos aplicativos de mídia simultaneamente.",3
"A qualidade das transmissões de áudio em aplicativos de comunicação é clara na maioria das vezes, mas pode apresentar pequenas falhas.",2
"O celular suporta jogos pesados com desempenho aceitável.",4
"Produto funcional, mas senti falta de mais acessórios.",4
"O design é bonito, mas o material poderia ser mais resistente.",3
"Nem consegui usar. Veio quebrado!",1
"Design elegante e leve, perfeito para o dia a dia.",5
"Atendimento excelente, muito feliz com a compra.",4
"A qualidade da transmissão de áudio durante as chamadas é boa, mas pode haver pequenos ruídos.",3
"O aparelho não suporta fones com entrada P2, o que é frustrante.",2
"O sistema operacional é lento e cheio de bugs.",2
"O aparelho mantém a estabilidade durante atualizações de software.",3
"A personalização do teclado facilita a digitação.",4
"A qualidade das transmissões de vídeo ao vivo é boa, mas pode melhorar em termos de estabilidade.",3
"O celular não reconhece meu cartão SIM, está inutilizável.",1
"O carregador que acompanha o celular é de alta qualidade.",5
"O aparelho suporta bem a execução de aplicativos de comunicação sem interrupções.",5
"O sensor de proximidade não funciona, tela liga durante chamadas.",1
"A qualidade de construção é impecável, com materiais resistentes e duráveis.",4
"A interface de usuário facilita a navegação entre diferentes seções do aparelho.",5
"A qualidade das fotos em movimento é impressionante.",5
"O celular é muito frágil, a tela risca fácil e a bateria vicia rápido, não recomendo a compra.",1
"O celular é impressionante.",5
"A qualidade do display para leitura de textos é confortável para os olhos.",4
"A qualidade das transmissões de áudio durante as chamadas é muito baixa e com interferências constantes, dificultando a comunicação clara e eficiente.",1
"Serviço péssimo, uma escolha terrível.",1
"O aparelho mantém a integridade dos dados durante uso intenso.",3
"Excelente qualidade e design moderno, recomendo!",5
"A qualidade é incrível, recomendo muito.",5
"O celular é tudo o que eu sempre quis.",4
"O celular oferece integração com outros dispositivos da marca.",4
"Produto bom, adorei!",4
"O produto é eficiente, mas a configuração inicial foi complicada.",4
"O GPS é muito preciso, mesmo em áreas com sinal fraco.",5
"Horrível, não funcionou como esperado.",2
"Um celular excelente em todos os aspectos.",5
"A qualidade das chamadas de vídeo é boa, com imagem nítida na maioria das vezes.",3
"Produto atendeu minhas expectativas, gostei muito.",5
"A tela tem uma ótima resolução, mas reflete muito a luz.",4
"Bom para quem busca um celular simples e funcional.",3
"Atende bem às minhas necessidades, sem grandes problemas.",3
"A memória RAM de 8GB garante multitarefa sem travamentos.",5
"O aparelho não suporta aplicativos básicos de produtividade.",1
"A qualidade das transmissões de áudio em aplicativos de comunicação é muito boa, sem falhas técnicas.",5
"A funcionalidade de multitarefa é aceitável, mas não muito fluida.",2
"O manual é muito básico, senti falta de mais detalhes técnicos.",3
"Entrega dentro do prazo, mas o produto é muito básico.",3
"O celular lida bem com a execução de aplicativos de produtividade sem apresentar lentidão, mantendo a eficiência no trabalho.",2
"O atendimento foi ótimo e me ajudaram na configuração.",5
"Dei de presente para minha esposa! Ela adorou!",5
"A interface do celular é extremamente lenta para carregar aplicativos e responder aos toques, tornando o uso frustrante.",1
"Caiu no chão e quebrou! Material de péssima qualidade!",1
"O celular veio com arranhões na tela.",1
"O dispositivo não reconhece os acessórios compatíveis.",1
"A tela apresenta manchas após alguns meses de uso.",1
"O aparelho possui opções suficientes de conectividade sem fio.",3
"Super recomendo! Um dos melhores telefones que já tive!",5
"Extremamente lento, até para tarefas simples.",1
"É um bom produto, mas não é ideal para quem busca alta performance.",3
"A integração com aplicativos de produtividade é impecável, muito eficiente.",5
"O celular veio com um manual de instruções incompleto.",1
"Excelente serviço, estou muito satisfeito porque o preço é justo.",4
"A duração da bateria é suficiente para tarefas básicas e moderadas.",3
"Não gostei porque o atendimento foi péssimo.",1
"O reconhecimento facial funciona mesmo em ambientes com pouca luz.",4
"A qualidade das transmissões de vídeo ao vivo em plataformas de streaming é muito boa.",4
"Odiei! Qualidade vagabunda!",1
"A qualidade da câmera é razoável, não excepcional.",3
"A duração da bateria é mediana, não dura o dia todo.",2
"A qualidade das transmissões de áudio em aplicativos de comunicação é muito boa.",4
"Gostei do desempenho, mas o armazenamento é limitado.",3
"O celular não consegue executar aplicativos de produtividade sem problemas.",1
"Adorei a funcionalidade de parear com outros dispositivos.",5
"Nota zero!",1
"A duração da bateria é boa, mas esperava mais pelo preço.",4
"Um celular inovador e cheio de recursos.",5
"A qualidade das transmissões de vídeo ao vivo em plataformas de streaming é excelente.",5
"A qualidade do áudio nas chamadas é cristalina.",5
"O telefone não possui sensor de proximidade funcionando corretamente.",1
"O produto é ok, nada demais. não se destaca no mercado.",3
"O microfone capta áudio muito bem, ótimo para gravações.",5
"Design bonito, mas a traseira arranha facilmente.",3
"O celular suporta carregamento rápido e sem fio, muito prático.",5
"A qualidade da câmera do celular é extremamente baixa, mesmo em condições de boa iluminação, resultando em fotos ruins, sem detalhes e pouco satisfatórias para o usuário.",1
"O aparelho possui um bom equilíbrio entre funcionalidades e facilidade de uso.",3
"O desempenho é ótimo para streaming, sem interrupções.",5
"A câmera do celular nunca tira fotos nítidas.",1
"A atualização do sistema trouxe melhorias significativas.",4
"A configuração inicial foi complicada e demorada.",2
"O celular mantém a conectividade estável durante chamadas de conferência em aplicativos de comunicação.",5
"A interface gráfica do celular é muito desorganizada e confusa.",1
"O aparelho possui um bom equilíbrio entre funcionalidades básicas e avançadas.",5
"O celular oferece uma experiência fluida e sem travamentos, mesmo com vários aplicativos abertos.",4
"A qualidade da câmera em condições de baixa iluminação é excelente para uso casual, fotos nítidas mesmo à noite.",5
"O desempenho em multitarefa é excelente.",5
"Note que depois de alguns meses, a tela ficou com uns pixels pretos.",2
"O celular possui um sistema de notificações de atualizações e novidades de aplicativos muito eficiente.",5
"O produto apresenta bom desempenho, mas é complicado de usar.",3
"Não funciona direito, vou pedir reembolso.",1
"Entrega rápida e produto incrível, recomendo.",5
"Estou muito contente com a minha compra, excelente aparelho!",5
"Produto eficiente, mas poderia ter mais recursos.",3
"O celular veio com defeito de fábrica.",1
"O produto é robusto e eficiente, recomendo fortemente.",5
"A tela tátil responde de forma fluida e sem atrasos.",5
"O dispositivo supera as expectativas em todas as áreas.",5
"O aparelho possui um bom equilíbrio entre funcionalidades de hardware e software.",4
"A bateria não dura nem meio dia de uso.",1
"A função de reconhecimento facial é extremamente precisa e rápida.",5
"A duração da bateria durante chamadas é excelente.",5
"O celular é uma obra de arte da engenharia.",5
"O aparelho possui um sistema de gerenciamento de notificações prioritárias eficiente.",5
"Muito mais ou menos. Pensava que seria bem melhor!",2
"A funcionalidade de backup na nuvem é automática e sem erros.",3
"Atendeu às necessidades básicas, mas nada excepcional.",3
"O reconhecimento facial funciona bem, até com pouca luz.",5
"O desempenho do aparelho é excelente, atende todas as minhas necessidades.",5
"A tela OLED tem cores vibrantes e ótima resolução.",5
"A qualidade das chamadas de voz é clara e sem interrupções.",3
"Produto inovador, superou minhas expectativas.",5
"O modo de economia de energia é super eficiente.",5
"O aparelho mantém a integridade das chamadas em áreas com sinal fraco.",3
"O celular é perfeito para quem trabalha com fotografia.",5
"Gostei muito, já recomendei para meus amigos.",5
"A qualidade do vídeo gravado pela câmera é impressionante.",5
"Serviço péssimo, uma escolha terrível.",2
"Os recursos de acessibilidade são excelentes.",5
"Gostaria que houvesse mais informações técnicas disponíveis no site.",3
"O aparelho vem com acessórios de alta qualidade incluídos na embalagem.",5
"A câmera noturna é funcional, mas as fotos podem ficar granuladas.",2
"A qualidade do produto é excelente, recomendo fortemente.",5
"O celular não suporta a instalação de aplicativos essenciais sem erros constantes e falhas, limitando sua funcionalidade e utilidade para o usuário final.",1
"Não vem com fone de ouvido, mas isso já era esperado.",3
"O celular não consegue manter a conexão Bluetooth durante o uso.",1
"O aparelho não mantém a estabilidade durante chamadas de longa duração.",1
"Um celular moderno e com design inovador.",4
"A bateria descarrega muito rápido, mal dura algumas horas de uso intenso.",1
"Som de alta qualidade, perfeito para audiophiles.",5
"O design é bonito, mas o desempenho é apenas razoável.",3
"O aparelho não possui suporte para cartões de memória maiores.",2
"Produto eficiente, mas poderia ser mais robusto.",3
"O aparelho mantém a integridade dos dados durante o uso de aplicativos de armazenamento em nuvem.",5
"Um celular razoável, adequado para o uso cotidiano.",2
"A câmera frontal não é boa para selfies em ambientes escuros.",2
"O celular lida bem com a execução de aplicativos de produtividade sem apresentar lentidão ou travamentos.",3
"Faltam opções de personalização, o que é muito frustrante.",1
"O aparelho mantém a estabilidade durante o uso de múltiplos aplicativos simultaneamente.",5
"O celular lida bem com a navegação em sites complexos.",3
"Recebi dentro do prazo e o produto atendeu às expectativas.",4
"Gostei do tamanho da tela, ideal para assistir vídeos.",5
"A qualidade da construção evita danos por quedas leves.",3
"O aparelho não suporta a instalação de aplicativos populares sem apresentar falhas constantes e travamentos frequentes, limitando sua funcionalidade e satisfação do usuário.",1
"A função de carregamento rápido funciona conforme prometido.",3
"Material de alta qualidade, estou impressionado.",5
"O celular veio com a caixa amassada.",1
"Pior compra do ano!",1
"O celular possui armazenamento expansível, o que é muito útil.",5
"O aparelho apresenta uma durabilidade excelente, mesmo com uso diário intenso.",5
"O celular mantém a performance durante uso prolongado.",3
"A tela ocupa quase toda a frente, visual muito moderno.",5
"O aparelho possui um bom equilíbrio entre desempenho e eficiência energética.",3
"A qualidade do vídeo em reprodução de mídias é boa.",3
"O material parece resistente, mas ainda estou testando.",4
"A funcionalidade de gerenciamento de armazenamento é eficiente.",3
"A câmera faz vídeos em câmera lenta com muita nitidez.",5
"A qualidade das chamadas de vídeo é excelente, com imagem nítida.",4
"A memória interna é limitada para aplicativos modernos.",2
"As notificações de mensagens não chegam, perdendo comunicações importantes.",1
"Não funcionou como anunciado, fiquei frustrado.",1
