review,rating
"O material parece resistente, mas vou acompanhar o uso.",4
"A tela tem um brilho ótimo, mesmo sob a luz do sol.",4
"É o melhor celular que já tive, sem dúvidas.",5
"O celular desliga sozinho com frequência, o que me impede de usá-lo corretamente.",1
"O celular é bonito e leve, mas a bateria dura pouco e a câmera não é das melhores.",2
"A câmera frontal oferece selfies de alta qualidade, com bom nível de detalhes.",4
"A qualidade das transmissões de áudio em aplicativos de comunicação é clara e sem falhas.",5
"A câmera frontal é adequada para selfies de boa qualidade.",4
"A qualidade do vídeo em chamadas é clara e sem atrasos.",3
"O produto é compacto, mas bastante eficiente.",4
"É compatível com diversos acessórios, isso é ótimo.",5
"O celular tem um modo noturno que melhora bastante as fotos em ambientes escuros.",4
"O preço é alto, mas o desempenho é satisfatório.",4
"O aparelho possui um bom equilíbrio entre design e funcionalidade.",3
"Demorou pra chegar, mas é execelente!",4
"A função de backup local é fácil de usar e confiável.",3
"Decepcionante, não funcionou como esperado.",2
"Queria que a bateria durasse mais tempo!",2
"O aparelho mantém a integridade dos dados durante sincronizações com serviços de armazenamento externo.",4
"Entrega ruim, nunca mais compro dessa loja.",2
"Design elegante e muito confortável de segurar.",4
"O celular não tem entrada para cartão de memória.",2
"O celular não consegue manter a conexão Bluetooth durante o uso intenso e prolongado.",1
"Tanta propaganda pra nada! Decepcionada!",1
"Não gostei, achei que o desempenho seria melhor.",2
"O celular possui um bom sistema de gerenciamento de notificações para aplicativos de redes sociais, evitando sobrecarga.",3
"A entrega foi rápida, mas o produto não correspondeu às expectativas.",3
"A funcionalidade de desbloqueio por impressão digital é eficiente na maioria das vezes.",3
"Entrega bem rápida, superou minhas expectativas.",5
"A qualidade das transmissões de vídeo em chamadas de vídeo é boa, mas pode apresentar pequenas falhas de conexão.",3
"A tela é clara, mas a resolução poderia ser melhor.",3
"O celular veio com a tela trincada.",1
"A função de reconhecimento facial é eficiente na maioria das vezes.",3
"O celular não suporta aplicativos essenciais, limitando seu uso.",1
"É um celular ideal para quem usa o celular para o básico.",3
"É um celular perfeito para quem joga bastante.",5
"Muito feio, diferente das imagens do site!",1
"O celular não suporta a conexão com dispositivos de armazenamento externo.",1
"O sistema Android puro é leve e rápido.",5
"A função de gravação de vídeo é estável e sem interrupções.",4
"A câmera não tem boa qualidade em ambientes com pouca luz.",2
"A câmera com zoom é incrível, sem perda de qualidade.",5
"A qualidade da câmera do celular é extremamente baixa, mesmo em condições de boa iluminação, resultando em fotos ruins.",1
"Veio com arranhões, mas nada que comprometa o uso.",3
"A câmera frontal tem ótima qualidade para videoconferências.",5
"O leitor biométrico na tela é muito prático.",4
"O Bluetooth falha na transmissão de áudio para fones de ouvido.",1
"Esperava bem mais desse telefone.",1
"Muito bom, comprarei novamente!",5
"O celular é muito confortável de segurar por longos períodos.",4
"A bateria do celular não suporta uso contínuo por mais de algumas horas.",1
"Vale muito à pena, principalmente pelo preço!",5
"A funcionalidade de backup na nuvem é automática e protege meus dados de forma eficiente, garantindo que minhas informações estejam seguras sem necessidade de intervenções manuais constantes, facilitando a gestão dos meus dados pessoais e profissionais.",3
"Celular básico, sem grandes qualidades.",3
"Funciona bem, mas não justifica o preço alto.",3
"O design é moderno e elegante, realmente chama a atenção.",5
"O celular possui uma grande capacidade de armazenamento interno, ideal para guardar fotos, vídeos e aplicativos.",4
"O aparelho equilibra perfeitamente desempenho e consumo de bateria.",5
"A função de gravação de vídeo é funcional, mas a qualidade das gravações poderia ser melhor.",2
"O aparelho responde rapidamente a todos os comandos.",5
"Gostei da experiência de compra, produto superou minhas expectativas.",5
"O celular lida bem com a execução de aplicativos de redes sociais sem apresentar lentidão.",5
"Até que achei bom, para o preço que paguei!",3
"O aparelho veio com um pequeno defeito no botão, mas consegui trocar.",3
"Funciona bem, mas um pouco frágil.",2
"A funcionalidade de modo de economia de dados funciona conforme esperado.",3
"O manual é claro e o produto fácil de usar, adorei.",5
"O celular suporta carregamento sem fio reverso.",4
"Excelente serviço, estou muito satisfeito porque o atendimento foi excepcional.",5
"O celular mantém a estabilidade durante o uso de aplicativos de mensagens instantâneas.",3
"A interface do usuário é personalizável e fácil de usar.",4
"A traseira de vidro dá um toque elegante, mas é escorregadia.",4
"A interface gráfica do celular é muito confusa e difícil de usar.",1
"A duração da bateria é média, dura o dia com uso moderado.",3
"O celular possui armazenamento expansível, o que é uma vantagem para quem precisa de mais espaço.",3
"O desempenho é aceitável, mas nada de excepcional.",3
"Eu confiava muito nessa marca, agora não compro nunca mais!",1
"O aparelho mantém a estabilidade ao usar múltiplos aplicativos simultaneamente.",4
"A memória RAM é suficiente para o uso diário.",3
"O celular superaquece rapidamente durante o uso.",1
"As chamadas são claras e com boa qualidade de áudio.",4
"Produto eficiente e muito silencioso, gostei muito.",5
"Entrega antes do prazo, e o produto é muito bom.",5
"O aparelho suporta bem a execução de aplicativos de produtividade intensiva sem problemas de desempenho, ajudando-me a ser mais eficiente no trabalho e nas minhas atividades diárias sem enfrentar interrupções ou lentidão.",3
"A bateria incha com facilidade.",1
"Não suporta cartão de memória, o que limita o armazenamento.",3
"Não vale o preço, me decepcionei com a compra.",2
"Excelente serviço, estou muito satisfeito porque superou minhas expectativas.",5
"Fácil de usar, muito prático para o meu dia a dia.",5
"Recebi antes do prazo, muito feliz com a compra.",5
"A conexão Wi-Fi é instável.",2
"Os atalhos do sistema facilitam muito o uso no dia a dia.",5
"Ruim, lento e pesado!",1
"Um celular que me surpreendeu positivamente.",5
"O telefone travou várias vezes nos primeiros dias de uso.",2
"A bateria esquenta muito durante o carregamento.",2
"A qualidade do som nos fones que acompanham é baixa.",2
"O celular tem ótima resistência à água, usei até na piscina.",5
"A integração com outros dispositivos do ecossistema é perfeita.",5
"A sincronização com a nuvem é rápida e eficiente.",5
"A qualidade das chamadas de voz é clara e sem ruídos indesejados.",4
"O aparelho mantém a integridade das configurações personalizadas após atualizações de software, sem grandes problemas.",3
"O celular mantém a estabilidade durante uso prolongado de aplicativos de mapas.",3
"A navegação na internet é razoavelmente rápida, mas pode ser lenta em alguns sites.",2
"O celular é incrível.",5
"A interface do usuário do celular é muito complicada e não intuitiva.",1
"O celular possui um bom sistema de gerenciamento de aplicativos em segundo plano.",3
"Bom para quem busca um celular intermediário com bom desempenho.",4
"A conectividade Bluetooth é estável, conecta rápido com fones.",5
"A qualidade da câmera em fotos noturnas é aceitável para uso casual.",3
"A facilidade de instalação de aplicativos é ótima.",5
"O celular é aceitável, mas há opções melhores no mercado.",3
"A funcionalidade de multitarefa é eficiente e sem travamentos.",5
"O celular perde sinal constantemente, mesmo em áreas com boa cobertura.",1
"Produto ruim, me arrependi muito.",1
"O aparelho superaquece rapidamente, é perigoso para o uso diário.",1
"Atualizações frequentes melhoram o desempenho constantemente.",4
"O aparelho possui um bom equilíbrio entre funcionalidades de hardware e software, proporcionando uma experiência de uso satisfatória sem comprometer a performance geral do celular, garantindo que todas as funcionalidades operem de forma harmoniosa e eficiente, sem conflitos ou gargalos que possam prejudicar o desempenho do aparelho.",3
"Infelizmente, o produto parou de funcionar após uma semana de uso.",1
"O aparelho suporta bem a execução de aplicativos de comunicação sem interrupções.",4
"As notificações não aparecem no centro de notificações.",1
"A película que veio de fábrica descolou rápido.",1
"A interface de câmera oferece múltiplas opções de configuração para fotos e vídeos.",5
"O celular é imbatível.",5
"A qualidade das transmissões de vídeo ao vivo é muito boa.",4
"O design é bonito, mas esperava mais desempenho.",3
"Sem dúvida o melhor que você vai encontrar nessa faixa de preço!",4
"O celular não mantém a conexão Bluetooth estável.",1
"O celular ficou inutilizável após uma semana de uso.",1
"As notificações aparecem de forma clara, mas a organização poderia ser melhor.",3
"A câmera frontal é perfeita para selfies de alta qualidade.",5
"A bateria dura bastante, mas leva muito tempo para carregar.",3
"O sinal do celular é muito fraco em áreas com pouca cobertura.",1
"A qualidade da reprodução de vídeos em alta definição é excepcional.",5
"A tela é muito pequena para o meu uso.",2
"Não funcionou com meu chip! Tive que devolver!",1
"A qualidade das chamadas é ruim, com chiados e ruídos.",1
"O sistema operacional é fluido e muito fácil de usar.",5
"O celular é leve e confortável de segurar por longos períodos.",5
"O celular oferece uma boa relação custo-benefício.",4
"O celular não consegue manter a conexão com o Wi-Fi em movimento.",1
"O sistema de reconhecimento facial falha constantemente.",1
"Recebi antes do prazo, muito satisfeito com a compra.",5
"O celular tem certificação IP68 de resistência à água e poeira.",5
"A qualidade do material parece barata e frágil.",1
"O aparelho suporta bem a execução de aplicativos de produtividade intensiva sem afetar o desempenho geral do celular.",3
"Entrega super rápida, muito satisfeito com a compra.",5
"A conectividade Wi-Fi é instável.",1
"A câmera tem muitos recursos interessantes, como o modo retrato.",4
"Muito melhor do que eu esperava!",5
"Decepcionante, o atendimento foi péssimo.",2
"A qualidade da tela para visualização de fotos é boa.",3
"A qualidade da tela para assistir a vídeos em diferentes plataformas é muito boa.",4
"O celular é fantástico.",5
"A câmera frontal com inteligência artificial melhora bastante as selfies.",5
"Produto não funciona, totalmente frustrante.",1
"A câmera traseira dupla tira fotos com excelente profundidade.",5
"Não consigo conectar o celular na minha TV.",1
"Smartphone normal, nada de especial.",2
"Não vale o preço pago, fiquei bastante insatisfeito.",1
"A função de bloqueio de aplicativos protege minha privacidade de forma eficaz e é fácil de configurar.",3
"Muito rápido e interface bonita!",4
"A qualidade do display para leitura de textos é confortável para os olhos.",5
"O aparelho veio com película e capinha, um ótimo bônus.",5
"O aparelho é rápido, mas a interface poderia ser mais amigável.",4
"O celular não consegue executar jogos sem travar ou desacelerar significativamente, prejudicando a experiência de jogo e a satisfação do usuário.",1
"Experiência péssimo, totalmente frustrante.",1
"O celular tem um bom equilíbrio entre desempenho e consumo de bateria.",3
"A atualização do sistema foi tranquila e sem problemas.",3
"O carregamento rápido permite recarregar a bateria em pouco tempo.",4
"A câmera ultra-wide tem um ótimo campo de visão.",5
"A tela tem uma ótima taxa de atualização, tornando a navegação muito fluida.",4
"A bateria dura o dia todo com uso moderado.",4
"O celular não suporta a instalação de novos aplicativos sem erros.",1
"A capa traseira é muito frágil.",1
"Um celular frágil e com acabamento ruim.",1
"A câmera frontal é funcional para selfies, mas a qualidade não é das melhores.",2
"As notificações aparecem de forma clara e bem organizadas.",5
"A qualidade do display para leitura é confortável para os olhos.",3
"O sensor biométrico é rápido e preciso, desbloqueando o celular instantaneamente.",4
"A conectividade Wi-Fi frequentemente cai.",1
"O sensor de impressão digital funciona muito bem.",5
"A qualidade de construção é excelente, muito resistente.",5
"A conectividade NFC funciona sem problemas para pagamentos móveis.",5
"A qualidade das fotos em movimento é aceitável, mas pode faltar nitidez.",2
"O celular possui entrada para fones de ouvido P2.",3
"Entrega horrível, nunca mais compro dessa loja.",2
"O celular oferece uma excelente relação custo-benefício, vale cada centavo.",5
"Muito insatisfatório, enfrentou várias falhas.",1
"Produto excelente para o preço, recomendo sem dúvidas.",5
"A interface do celular é extremamente lenta para carregar aplicativos e responder aos toques.",1
"A funcionalidade de multitarefa é eficiente e raramente trava.",4
"O celular não reconhece cartões de memória, mesmo os compatíveis.",1
"O dispositivo responde bem aos comandos de toque e gestos.",4
"O celular lida muito bem com a execução de aplicativos de redes sociais sem apresentar lentidão.",5
"O aparelho é adequado para uso diário.",3
"A interface de usuário facilita muito a navegação entre diferentes seções do aparelho, muito intuitiva.",5
"O celular possui um sistema de gerenciamento de arquivos funcional, mas poderia ser mais intuitivo.",3
"As notificações de mensagens chegam sem atrasos.",3
"Atendimento não funciona, não recomendo de jeito nenhum.",2
"A atualização para a última versão do sistema foi problemática.",2
"O celular é ideal para quem precisa de um celular resistente para o trabalho.",4
"O aparelho atualiza facilmente para as últimas versões do sistema operacional.",4
"O aparelho suporta bem a personalização de widgets na tela inicial.",3
"Material muito frágil!",1
"A tela é resistente, mesmo sem película protetora.",5
"A interface de usuário é intuitiva e facilita a navegação entre aplicativos, mas poderia ser mais personalizada.",2
"Aplicativos travam ou fecham sozinhos frequentemente.",1
"A qualidade dos vídeos na tela é fantástica, uma verdadeira imersão.",5
"O celular me conecta com o mundo.",4
"Material frágil, esperava algo mais resistente.",2
"Tive muitos problemas técnicos com o celular.",1
"O celular trava constantemente.",1
"O celular trava ao abrir aplicativos básicos, impossível de usar.",1
"A tela AMOLED tem cores vibrantes e ótimo contraste.",5
"O celular mantém a conectividade estável durante o uso de aplicativos de música.",3
"O celular lida bem com a execução de múltiplos aplicativos de mídia simultaneamente, sem apresentar lentidão ou travamentos, permitindo que eu desfrute de uma experiência multitarefa eficiente.",3
"O aparelho esquenta demais durante o uso intenso.",2
"O material é fraco, não recomendo para quem precisa de algo resistente.",2
"Adorei o desempenho nos jogos, roda tudo sem travar.",5
"O design é arrojado, mas o funcionamento é básico.",3
"A funcionalidade de assistente virtual responde de forma eficaz.",3
"Produto caro, me arrependi muito.",2
"O GPS nunca funciona corretamente.",1
"O celular mantém a conectividade estável durante chamadas de conferência em aplicativos de comunicação, facilitando reuniões.",3
"O sistema operacional é fácil de usar, mas às vezes apresenta lentidão.",3
"A bateria vicia muito rápido.",1
"O celular não consegue manter a conexão Bluetooth durante o uso intenso.",1
"O aparelho apresenta boa durabilidade, mas pode mostrar sinais de desgaste com uso intenso.",2
"Veio com defeito, mas consegui resolver com o suporte.",3
"Produto durável e com ótimo desempenho, recomendo.",5
"Fiquei insatisfeito, não correspondeu ao que esperava.",1
"O suporte ao 5G melhora muito a experiência de navegação.",5
"O celular é a melhor opção do mercado.",5
"A funcionalidade de reconhecimento de voz funciona perfeitamente.",5
"O aparelho possui um equilíbrio perfeito entre desempenho e eficiência energética, ótima bateria.",5
"Os atalhos personalizáveis são muito úteis.",5
"A qualidade das chamadas de vídeo é excelente, com imagem nítida e sem atrasos.",5
"Não gostei da textura do material, parece muito frágil.",2
"A função de busca por aplicativos instalados é rápida e eficiente, facilitando o acesso aos aplicativos desejados.",3
"O material é de baixa qualidade, mas atende ao básico.",3
"O aparelho apresenta atrasos na resposta ao toque.",1
"A duração da bateria é excelente, uso o dia todo sem carregar.",5
"Entrega péssima, nunca mais compro dessa loja.",1
"Design moderno e muito leve, perfeito para o dia a dia.",4
"O aparelho não reconhece redes Wi-Fi estáveis.",1
"A função de busca por arquivos e documentos no dispositivo é rápida e eficiente.",3
"A qualidade das transmissões de áudio em chamadas de voz é clara.",3
"A tela tem ótima nitidez, mesmo em vídeos com baixa qualidade.",5
"Produto bom, mas o atendimento foi horrível.",3
"Me arrependi logo que abri a caixa. Feio e ruim de usar.",1
"A funcionalidade de backup automático protege meus dados de forma eficiente.",5
"Produto bonito e eficiente, recomendo para todos.",5
"Um ótimo companheiro para o dia a dia.",4
"Gostei da ergonomia, mesmo sendo grande, é confortável de segurar.",5
"O som é bom, mas poderia ter mais graves.",4
"Tela colorida e brilhante. Comprei pra ver vídeos e é excelente!",5
"Produto chegou rápido e bem embalado.",3
"O preço está acima da média para as especificações oferecidas.",2
"Uso muito para estudar, ler livros digitais e jogar de vez em quando. Gostei!",5
"A qualidade do display para leitura de textos é confortável para os olhos, mesmo em longas sessões.",5
"O celular possui um bom equilíbrio entre funcionalidades e preço.",3
"Entrega muito rápida, mas a qualidade do material é apenas mediana.",3
"O aparelho responde bem a comandos simples, mas trava em tarefas mais complexas.",3
"O celular mantém a conectividade estável durante chamadas de conferência em aplicativos de comunicação, facilitando reuniões sem falhas de conexão ou interrupções que possam atrapalhar a fluidez das discussões.",3
"O celular é um pouco pesado, mas robusto.",4
"Recebi um modelo diferente do que pedi, mas gostei.",4
"Foi uma experiência eficiente, uma das melhores compras.",4
"O aparelho é ideal para quem usa redes sociais com frequência.",4
"O celular possui alto-falantes estéreo com som potente e imersivo.",4
"Comparado com o modelo anterior, a câmera teve uma melhora significativa.",4
"A conectividade Bluetooth é rápida e sem falhas.",5
"O aparelho não é compatível com alguns acessórios que já possuo.",2
"A bateria dura muito pouco em jogos.",2
"O sensor de impressão digital na lateral é muito rápido e preciso.",4
"O aparelho possui um bom sistema de gerenciamento de notificações prioritárias.",5
"Pior impossível! Só arrependimento!",1
"A função de busca no dispositivo é rápida e eficaz.",3
"Foi uma experiência incrível porque o atendimento foi excepcional.",4
"A qualidade das transmissões de áudio é muito baixa durante as chamadas.",1
"Entrega muito rápida, mas o produto não é intuitivo.",3
"O aparelho equilibra bem funcionalidades básicas e avançadas, mas ainda há espaço para melhorias.",2
"A bateria do celular não mantém a carga por mais de algumas horas de uso contínuo e intensivo, necessitando de recargas frequentes.",1
"Os botões de volume poderiam ser mais firmes.",3
"O celular lida bem com a execução de aplicativos de redes sociais sem apresentar lentidão ou problemas de desempenho.",3
"Queria que tivesse mais aplicativos!",2
"O celular apresenta falhas no sensor de proximidade, desligando a tela inesperadamente.",1
"A interface gráfica é moderna e agradável aos olhos.",4
"O aparelho suporta bem a execução de aplicativos de produtividade intensiva sem problemas de desempenho.",3
"O celular é resistente a quedas e arranhões.",4
"Produto compacto e leve, perfeito para levar na bolsa.",5
"O som dos alto-falantes é adequado para chamadas e músicas baixas.",3
"Adorei o design e a funcionalidade, muito prático.",5
"É um celular que atendeu todas as minhas expectativas.",4
"Última vez que compro essa marca. Péssimo!",5
"O aparelho suporta bem a execução de aplicativos de produtividade intensiva sem grandes problemas de desempenho.",2
"Achei o material muito frágil, esperava algo mais robusto.",2
"O celular não consegue se conectar a dispositivos de áudio externos.",1
"A interface de usuário facilita a organização e personalização de aplicativos e pastas na tela inicial, permitindo que eu mantenha meu celular organizado de acordo com minhas preferências.",3
"O volume do toque é muito baixo.",2
"O aparelho reinicia sozinho sem aviso prévio.",1
"Melhor telefone que já tive!",5
"O sensor de proximidade não funciona corretamente às vezes.",3
"Horrível, a qualidade é muito baixa.",1
"A conexão 4G é lenta e instável.",1
"Achei um pouco caro, mas funciona conforme o esperado!",3
"O celular é resistente a quedas, já testei sem querer!",5
"O microfone capta muito ruído e distorce o áudio.",1
"Design inovador, adorei o visual e a funcionalidade.",5
"A câmera faz vídeos incríveis em câmera lenta.",5
"O celular possui um bom sistema de gerenciamento de aplicativos em segundo plano, evitando consumo excessivo de recursos e prolongando a duração da bateria durante o uso prolongado de múltiplos aplicativos, garantindo que o aparelho continue funcionando de forma eficiente mesmo durante sessões intensas de uso.",3
"Produto caro e sem qualidade, não recomendo.",1
"O aparelho mantém a integridade das configurações personalizadas após todas as atualizações de software.",5
"O celular não suporta a expansão de armazenamento via cartão SD de forma confiável e eficiente, limitando o espaço disponível para armazenamento de dados importantes e causando insatisfação.",1
"Gostei do design e da cor! Fácil de usar!",5
"O celular lida bem com a execução de aplicativos de redes sociais sem apresentar lentidão ou problemas de desempenho, permitindo que eu me mantenha conectado de forma eficiente e sem interrupções que possam comprometer a interação e a atualização constante nas minhas redes sociais preferidas.",3
"O design é bonito e o produto é funcional, gostei.",5
"O design é incrível, e o desempenho também é ótimo.",5
"O celular veio com fones de ouvido USB-C.",3
"A interface de usuário permite fácil acesso às configurações de privacidade, mas algumas opções são limitadas.",2
"O design é impecável, mas poderia ser mais leve.",4
"A função de backup local é fácil de acessar e configurar, proporcionando segurança para os dados.",2
"O celular é muito intuitivo, aprendi a usar rapidinho.",4
"A função de espelhamento de tela funciona sem atrasos.",3
"A câmera frontal é ótima para selfies.",4
"Desempenho superior ao que eu esperava, altamente recomendado.",5
"O modo retrato desfoca bem o fundo, dando um toque profissional às fotos.",5
"O aparelho possui um bom sistema de gerenciamento de notificações silenciadas.",3
"A personalização das configurações é ampla e fácil de ajustar.",5
"Superou minhas expectativas, um excelente celular.",5
"A qualidade da câmera do celular é muito ruim em todas as condições de iluminação.",1
"A câmera do celular apresenta falhas no foco automático.",1
"Não recomendo, o produto apresentou defeitos logo no início.",1
"O modo de leitura é excelente para uso noturno.",5
"A velocidade de carregamento é fantástica com a função de carregamento rápido.",5
"Produto robusto, ideal para uso diário.",5
"Atendimento decepcionante, não recomendo de jeito nenhum.",2
"A tela tátil responde de forma fluida e sem atrasos perceptíveis.",4
"O manual é difícil de entender, mas o suporte técnico foi excelente.",4
"O aparelho não suporta a instalação de aplicativos populares sem falhas constantes.",1
"A câmera tem ótima estabilização para vídeos.",5
"O celular mantém a estabilidade durante uso prolongado.",3
"O celular não vem com carregador na caixa, o que foi decepcionante.",2
"O aparelho possui um excelente sistema de segurança integrado.",5
"O aparelho mantém a estabilidade ao usar aplicativos de redes sociais.",3
"As atualizações do sistema deixam o aparelho mais lento.",1
"O produto não corresponde à descrição no site.",1
"O dispositivo não conecta ao Bluetooth de forma estável.",1
"Horrível e ruim de usar!",1
"O modo de economia de bateria é eficiente e intuitivo.",5
"A funcionalidade de backup automático é útil, mas pode demorar um pouco para completar.",3
"O material parece resistente, mas é muito pesado.",3
"A duração da bateria durante a reprodução de vídeos poderia ser melhor.",3
"A câmera possui estabilização de imagem, ideal para vídeos.",5
"Superou minhas expectativas!",4
"A funcionalidade de reconhecimento facial é segura e confiável.",5
"Design moderno e recursos inovadores, uma experiência incrível.",5
"O produto é bom, mas o manual é confuso.",3
"A funcionalidade de backup na nuvem é fácil de usar e eficiente.",3
"O preço é alto para a qualidade oferecida.",2
"O celular é inigualável.",5
