review,rating
"Desempenho apresenta lentidão ao executar muitos aplicativos simultaneamente.",3
"Bateria descarrega rapidamente com o uso do GPS.",2
"Tela com baixo brilho em ambientes externos com muita luz solar.",2
"Design com poucas opções de cores.",3
"Preço abusivo, não condiz com os recursos oferecidos.",1
"Câmera com modo macro para fotos de objetos pequenos.",4
"Desempenho otimizado para redes sociais, navegação fluida.",4
"Bateria com longa duração em standby.",4
"Tela com bom ângulo de visão, cores consistentes.",4
"Design compacto e leve, fácil de transportar no bolso.",4
"Preço competitivo no mercado de entrada.",4
"Câmera com dificuldade em capturar detalhes em fotos com zoom digital.",3
"Desempenho apresenta travamentos em jogos com gráficos avançados.",2
"Bateria apresenta superaquecimento em dias quentes.",2
"Tela com baixa sensibilidade ao toque, dificuldade em digitar.",2
"Design com acabamento que acumula muitas marcas de dedo.",2
"Preço incompatível com a concorrência.",1
"Câmera com inteligência artificial para otimizar as fotos.",5
"Desempenho com processador potente, ideal para jogos e aplicativos exigentes.",5
"Bateria com carregamento ultrarrápido, carrega em poucos minutos.",5
"Tela com tecnologia de 120Hz, alta taxa de atualização para maior fluidez.",5
"Design com certificação IP68, resistente à água e poeira.",5
"Preço justo para um celular top de linha.",4
"Câmera com zoom óptico, fotos com aproximação sem perda de qualidade.",5
"Desempenho com sistema de resfriamento avançado, evita superaquecimento.",5
"Bateria com suporte a carregamento reverso sem fio.",5
"Tela com tecnologia HDR10+, cores mais vivas e realistas.",5
"Câmera com poucos recursos para gravação de vídeo.",3
"Desempenho apresenta lentidão após um longo período de uso.",3
"Bateria com autonomia abaixo da média em comparação com outros modelos.",3
"Tela com problemas de ghosting, rastros em imagens em movimento.",2
"Design pouco inovador, similar a outros modelos da marca.",3
"Preço muito acima da média do mercado.",1
"Câmera com modo noturno que captura boas fotos em baixa luminosidade.",4
"Desempenho com processador eficiente para tarefas do dia a dia.",4
"Bateria com boa autonomia para um dia inteiro de uso moderado.",4
"Tela com bom nível de brilho, visível sob a luz do sol.",4
"Design com bom acabamento e materiais de qualidade.",4
"Preço adequado para as configurações oferecidas.",4
"Câmera com dificuldade em ajustar o foco automaticamente.",2
"Desempenho apresenta travamentos ao abrir muitos aplicativos ao mesmo tempo.",3
"Bateria descarrega rapidamente com o uso constante de aplicativos de GPS.",2
"Tela com cores pouco saturadas, imagens sem muita vivacidade.",3
"Design pouco ergonômico, difícil de manusear com uma mão.",2
"Preço muito alto para os recursos que oferece.",1
"Câmera com modo profissional que permite ajustes manuais.",5
"Desempenho com alta performance em jogos e aplicativos pesados.",5
"Bateria com carregamento rápido e sem fio.",5
"Tela com alta resolução e densidade de pixels, imagens nítidas.",5
"Design com visual moderno e elegante.",5
"Preço competitivo em relação aos celulares premium.",4
"Câmera com estabilização óptica de imagem para fotos e vídeos mais nítidos.",4
"Desempenho com sistema operacional atualizado e interface intuitiva.",4
"Bateria com otimização de consumo de energia para maior duração.",4
"Tela com proteção contra riscos e arranhões.",4
"Câmera com poucas opções de personalização.",3
"Desempenho apresenta aquecimento excessivo durante jogos.",3
"Tela com problemas de touch screen, dificuldade em digitar e navegar.",2
"Design com acabamento que acumula impressões digitais.",2
"Preço incompatível com a qualidade e recursos oferecidos.",1
"Câmera com modo super macro para fotos com muitos detalhes de perto.",5
"Desempenho com processador otimizado para economia de energia.",4
"Bateria com longa duração em modo de espera.",4
"Tela com tecnologia que reduz a emissão de luz azul, mais confortável para os olhos.",4
"Design com construção robusta e resistente a impactos.",4
"Preço acessível para quem busca um celular intermediário com boas configurações.",4
"Câmera com dificuldade em capturar fotos em movimento.",2
"Desempenho apresenta lentidão ao abrir aplicativos pesados.",3
"Bateria com problemas de calibragem, mostra porcentagens incorretas.",2
"Tela com baixo contraste, imagens pouco definidas.",2
"Design com acabamento que descasca com facilidade.",1
"Preço muito elevado para um celular com configurações básicas.",1
"Câmera com gravação de vídeo em câmera lenta em alta resolução.",5
"Desempenho com alta velocidade de processamento para multitarefas.",5
"Bateria com tecnologia de carregamento adaptável, prolonga a vida útil da bateria.",5
"Tela com taxa de amostragem de toque alta, resposta rápida aos comandos.",5
"Design com certificação militar de resistência a quedas e impactos.",5
"Preço justo para um celular com recursos avançados.",4
"Câmera com zoom híbrido que combina zoom óptico e digital.",4
"Desempenho com sistema de segurança avançado para proteger os dados do usuário.",4
"Câmera com modo retrato aprimorado, fotos com efeito bokeh mais natural.",4
"Desempenho fluido para navegação na web e redes sociais.",4
"Bateria com boa autonomia para um dia de uso moderado.",4
"Tela com cores vibrantes e bom nível de brilho.",4
"Design moderno e compacto, fácil de manusear.",4
"Preço competitivo para a categoria.",4
"Câmera com dificuldade em fotos com pouca luz.",2
"Desempenho lento para jogos mais exigentes.",2
"Bateria com tempo de carregamento demorado.",3
"Design com acabamento em plástico que risca facilmente.",2
"Preço elevado para os recursos oferecidos.",1
"Câmera com estabilização eletrônica de imagem para vídeos mais estáveis.",4
"Desempenho eficiente para multitarefas e aplicativos do dia a dia.",4
"Bateria com modo de economia de energia para maior duração.",4
"Tela com proteção Gorilla Glass contra arranhões.",4
"Design elegante e sofisticado, com bom acabamento.",4
"Preço justo para as funcionalidades oferecidas.",4
"Câmera com dificuldade em focar objetos em movimento.",2
"Desempenho apresenta lentidão em alguns momentos de uso intenso.",3
"Bateria descarrega rapidamente com o uso constante de dados móveis.",2
"Design com pouca variedade de cores.",3
"Câmera com modo noturno para fotos claras mesmo em ambientes escuros.",4
"Desempenho rápido e ágil para abrir aplicativos e navegar na internet.",4
"Bateria com boa autonomia para um dia inteiro de uso normal.",4
"Tela com bom ângulo de visão e cores consistentes.",4
"Design com construção robusta e resistente.",4
"Preço acessível para quem busca um bom celular intermediário.",4
"Câmera com inteligência artificial para otimizar as fotos automaticamente.",5
"Tela com alta taxa de atualização para maior fluidez nas animações.",5
"Design com certificação IP68 de resistência à água e poeira.",5
"Câmera com zoom óptico para fotos com aproximação sem perda de qualidade.",5
"Desempenho com sistema de resfriamento avançado para evitar superaquecimento.",5
"Bateria com suporte a carregamento reverso sem fio para carregar outros dispositivos.",5
"Tela com tecnologia HDR10+ para cores mais vivas e realistas.",5
"Câmera com poucas opções de configuração manual para usuários avançados.",3
"Desempenho apresenta lentidão após um longo período de uso contínuo.",3
"Bateria com autonomia abaixo da média em comparação com outros modelos da mesma faixa de preço.",3
"Tela com problemas de ghosting, rastros em imagens em movimento rápido.",2
"Design pouco inovador, similar a outros modelos da mesma marca.",3
"Preço muito acima da média do mercado, não justifica a compra.",1
"Câmera com modo super macro para fotos com muitos detalhes em close-up.",5
"Desempenho com processador otimizado para economia de energia, boa autonomia.",4
"Bateria com longa duração em modo de espera, ideal para quem viaja muito.",4
"Tela com tecnologia que reduz a emissão de luz azul, mais confortável para os olhos em longas horas de uso.",4
"Design com construção robusta e resistente a impactos e arranhões.",4
"Preço acessível para quem busca um celular intermediário com boas configurações e recursos.",4
"Câmera com dificuldade em capturar fotos nítidas em movimento rápido.",2
"Bateria apresenta problemas de calibragem, mostrando porcentagens incorretas de carga.",2
"Tela com baixo contraste, resultando em imagens pouco definidas e sem profundidade.",2
"Design com acabamento que descasca com facilidade, mostrando sinais de desgaste prematuro.",1
"Preço muito elevado para um celular com configurações básicas e recursos limitados.",1
"Câmera com gravação de vídeo em câmera lenta em alta resolução, capturando detalhes incríveis.",5
"Desempenho com alta velocidade de processamento para multitarefas e aplicativos exigentes.",5
"Bateria com tecnologia de carregamento adaptável, prolongando a vida útil da bateria a longo prazo.",5
"Tela com alta taxa de amostragem de toque, proporcionando resposta rápida e precisa aos comandos.",5
"Design com certificação militar de resistência a quedas e impactos, garantindo maior durabilidade.",5
"Preço justo para um celular com recursos avançados e tecnologia de ponta.",4
"Câmera com zoom híbrido que combina zoom óptico e digital, permitindo aproximações com boa qualidade.",4
"Desempenho com sistema de segurança avançado para proteger os dados do usuário contra ameaças virtuais.",4
"Bateria com suporte a carregamento reverso sem fio, permitindo carregar outros dispositivos compatíveis sem a necessidade de cabos.",4
"Tela com tecnologia HDR10+ para cores mais vivas, realistas e maior contraste em vídeos e fotos.",4
"Câmera com poucas opções de personalização para fotógrafos mais experientes.",3
"Desempenho apresenta aquecimento excessivo durante longas sessões de jogos.",3
"Bateria demora muito tempo para carregar completamente, mesmo com carregador rápido.",3
"Tela com problemas de touch screen, apresentando dificuldade em reconhecer alguns toques e gestos.",2
"Design com acabamento que acumula impressões digitais e manchas com facilidade.",2
"Preço incompatível com a qualidade e recursos oferecidos em comparação com outros modelos do mercado.",1
"Câmera com modo super macro para fotos com muitos detalhes de objetos pequenos em close-up.",5
"Desempenho com processador otimizado para economia de energia, resultando em boa autonomia da bateria.",4
"Bateria com longa duração em modo de espera, ideal para quem não usa o celular com muita frequência.",4
"Tela com tecnologia que reduz a emissão de luz azul, proporcionando maior conforto para os olhos durante o uso prolongado.",4
"Design com construção robusta e resistente a impactos e arranhões, oferecendo maior durabilidade ao aparelho.",4
"Câmera com dificuldade em capturar fotos nítidas em movimento rápido, resultando em fotos borradas.",2
"Desempenho apresenta lentidão ao executar muitos aplicativos simultaneamente, prejudicando a experiência do usuário.",3
"Bateria apresenta problemas de calibragem, mostrando porcentagens incorretas de carga e desligando inesperadamente.",2
"Tela com baixo contraste, resultando em imagens pouco definidas e sem profundidade, prejudicando a visualização de fotos e vídeos.",2
"Design com acabamento que descasca com facilidade, mostrando sinais de desgaste prematuro e comprometendo a estética do aparelho.",1
"Preço muito elevado para um celular com configurações básicas e recursos limitados, não oferecendo um bom custo-benefício.",1
"A câmera grava vídeos em 8K com excelente qualidade de imagem e estabilização.",5
"O processador oferece desempenho de ponta para jogos e aplicativos pesados.",5
"A bateria com carregamento rápido de 120W carrega completamente em poucos minutos.",5
"A tela AMOLED com taxa de atualização de 144Hz oferece uma experiência visual incrivelmente fluida.",5
"O design elegante com acabamento em cerâmica é resistente e sofisticado.",5
"O preço é competitivo para um celular com tantas funcionalidades avançadas.",4
"A câmera com zoom óptico de 10x permite fotos com aproximação impressionante.",5
"O sistema de resfriamento líquido garante que o celular não superaqueça durante jogos intensos.",5
"A bateria com carregamento reverso sem fio permite carregar outros dispositivos compatíveis.",5
"A tela com tecnologia Dolby Vision oferece cores vibrantes e alto contraste.",5
"A câmera frontal não possui autofoco.",3
"O celular é um pouco pesado e volumoso.",3
"A bateria poderia ter uma autonomia um pouco maior.",3
"O software apresenta alguns pequenos bugs.",2
"O leitor de digitais na tela é um pouco lento.",2
"O preço é muito alto em comparação com outros modelos com configurações semelhantes.",1
"Ótima câmera para fotos diurnas, cores vibrantes e nítidas.", 4
"Desempenho fluido para tarefas cotidianas e redes sociais.", 4
"Bateria com boa duração, suficiente para um dia de uso moderado.", 4
"Tela com bom brilho e contraste, boa visualização em ambientes internos.", 4
"Design moderno e leve, confortável para segurar.", 4
"Bom custo-benefício para quem busca um celular intermediário.", 4
"Câmera com baixa qualidade em fotos noturnas, muito ruído.", 2
"Desempenho lento para jogos mais exigentes, travamentos frequentes.", 2
"Bateria com pouca autonomia para uso intenso, necessita de recargas frequentes.", 2
"Tela com baixa resolução, imagens pixeladas e pouco nítidas.", 2
"Design pouco ergonômico, desconfortável para uso prolongado.", 2
"Preço muito alto para as configurações oferecidas, não compensa.", 1
"Câmera com modo retrato eficiente, bom desfoque de fundo.", 4
"Desempenho excelente para jogos e aplicativos pesados, sem travamentos.", 5
"Bateria com autonomia para até dois dias de uso moderado, excelente duração.", 5
"Tela AMOLED com cores vibrantes, pretos profundos e alto contraste.", 5
"Design premium com acabamento em vidro e metal, muito elegante.", 5
"Preço competitivo em relação aos concorrentes da mesma categoria.", 4
"Câmera com estabilização óptica de imagem, vídeos mais estáveis e fotos nítidas.", 4
"Desempenho otimizado para inteligência artificial, recursos inteligentes e úteis.", 5
"Bateria com carregamento reverso, permite carregar outros dispositivos sem fio.", 5
"Tela com leitor de digitais integrado, desbloqueio rápido e seguro.", 4
"Câmera com poucas opções de configuração manual para usuários mais avançados.", 3
"Desempenho apresenta engasgos em multitarefas muito intensas, prejudicando a fluidez.", 3
"Bateria demora muito tempo para carregar completamente, mesmo com carregador rápido.", 3
"Tela com problemas de vazamento de luz em alguns pontos, afetando a qualidade da imagem.", 2
"Design pouco ergonômico, desconfortável para segurar por longos períodos de tempo.", 2
"Preço muito elevado, não justifica a compra considerando os recursos oferecidos.", 1
"Câmera filma em 4K com boa qualidade de imagem e estabilização.", 4
"Desempenho rápido e eficiente para abrir aplicativos e navegar na internet.", 4
"Bateria com modo de economia de energia, aumentando a autonomia em situações de baixa carga.", 4
"Tela com proteção contra arranhões Gorilla Glass, maior durabilidade e resistência.", 4
"Design com cores vibrantes e acabamento brilhante, visual moderno e atraente.", 4
"Preço acessível para quem busca um celular intermediário com bom desempenho.", 4
"Câmera com flash fraco, fotos noturnas com baixa qualidade e muito ruído.", 2
"Desempenho apresenta lentidão ao executar muitos aplicativos simultaneamente, prejudicando a experiência.", 3
"Bateria descarrega rapidamente com o uso constante de aplicativos de GPS, exigindo recargas frequentes.", 2
"Tela com baixo brilho em ambientes externos com muita luz solar, dificultando a visualização.", 2
"Design com poucas opções de cores, limitando a escolha do usuário.", 3
"Preço abusivo, não condiz com os recursos e a qualidade oferecidos pelo aparelho.", 1
"Câmera com modo macro para fotos de objetos pequenos com muitos detalhes.", 4
"Desempenho otimizado para redes sociais, proporcionando uma navegação fluida e sem travamentos.", 4
"Bateria com longa duração em modo de espera, ideal para quem não usa o celular com muita frequência.", 4
"Tela com bom ângulo de visão, garantindo cores consistentes mesmo em diferentes inclinações.", 4
"Design compacto e leve, facilitando o transporte no bolso e o uso com uma mão.", 4
"Preço competitivo no mercado de entrada, oferecendo um bom custo-benefício.", 4
"Câmera com dificuldade em capturar detalhes em fotos com zoom digital, resultando em imagens borradas.", 3
"Desempenho apresenta travamentos em jogos com gráficos avançados, prejudicando a jogabilidade.", 2
"Bateria apresenta superaquecimento em dias quentes ou durante o uso intenso, causando desconforto.", 2
"Tela com baixa sensibilidade ao toque, dificultando a digitação e a navegação em alguns momentos.", 2
"Design com acabamento que acumula muitas marcas de dedo, exigindo limpeza constante.", 2
"Preço incompatível com a concorrência, oferecendo menos recursos por um valor mais alto.", 1
"Câmera com inteligência artificial para otimizar as fotos automaticamente, reconhecendo cenas e ajustando as configurações.", 5
"Desempenho com processador potente, ideal para jogos e aplicativos exigentes, oferecendo uma experiência fluida e sem travamentos.", 5
"Bateria com carregamento ultrarrápido, carregando completamente em poucos minutos, ideal para quem tem pressa.", 5
"Tela com alta taxa de atualização para maior fluidez nas animações e transições, proporcionando uma experiência visual mais agradável.", 5
"Design com certificação IP68 de resistência à água e poeira, garantindo maior durabilidade e segurança em diferentes ambientes.", 5
"Preço justo para um celular top de linha, oferecendo recursos e tecnologias avançadas.", 4
"Câmera com zoom óptico para fotos com aproximação sem perda de qualidade, ideal para fotografar objetos distantes.", 5
"Desempenho com sistema de resfriamento avançado para evitar superaquecimento durante o uso intenso, garantindo um desempenho consistente.", 5
"Bateria com suporte a carregamento reverso sem fio, permitindo carregar outros dispositivos compatíveis sem a necessidade de cabos.", 5
"Tela com tecnologia HDR10+ para cores mais vivas, realistas e maior contraste em vídeos e fotos, proporcionando uma experiência visual imersiva.", 5
"Câmera com poucas opções de configuração manual para fotógrafos mais experientes, limitando a criatividade.", 3
"Desempenho apresenta lentidão após um longo período de uso contínuo, exigindo reinicializações frequentes.", 3
"Bateria com autonomia abaixo da média em comparação com outros modelos da mesma faixa de preço, exigindo recargas mais frequentes.", 3
"Tela com problemas de ghosting, apresentando rastros em imagens em movimento rápido, prejudicando a visualização de vídeos e jogos.", 2
"Design pouco inovador, similar a outros modelos da mesma marca, sem muitos diferenciais estéticos.", 3
"Preço muito acima da média do mercado, não justifica a compra considerando os recursos e as especificações técnicas.", 1
"A câmera grava vídeos em 8K com excelente qualidade de imagem e estabilização, ideal para produções profissionais.", 5
"O processador oferece desempenho de ponta para jogos e aplicativos pesados, garantindo uma experiência fluida e sem interrupções.", 5
"A bateria com carregamento rápido de 120W carrega completamente em poucos minutos, ideal para quem tem uma rotina agitada.", 5
"A tela AMOLED com taxa de atualização de 144Hz oferece uma experiência visual incrivelmente fluida, ideal para jogos e vídeos com alta taxa de quadros.", 5
"O design elegante com acabamento em cerâmica é resistente a riscos e sofisticado, conferindo um visual premium ao aparelho.", 5
"O preço é competitivo para um celular com tantas funcionalidades avançadas e tecnologia de ponta.", 4
"A câmera com zoom óptico de 10x permite fotos com aproximação impressionante, capturando detalhes distantes com alta qualidade.", 5
"O sistema de resfriamento líquido garante que o celular não superaqueça durante jogos intensos ou uso prolongado, mantendo o desempenho consistente.", 5
"A bateria com carregamento reverso sem fio permite carregar outros dispositivos compatíveis, como fones de ouvido e smartwatches.", 5
"A tela com tecnologia Dolby Vision oferece cores vibrantes, alto contraste e brilho intenso, proporcionando uma experiência visual imersiva em filmes e séries.", 5
"A câmera frontal não possui autofoco, o que pode dificultar a captura de selfies nítidas em algumas situações.", 3
"O celular é um pouco pesado e volumoso, o que pode ser desconfortável para algumas pessoas.", 3
"A bateria poderia ter uma autonomia um pouco maior para usuários que fazem uso muito intenso do aparelho.", 3
"O software apresenta alguns pequenos bugs que podem ser corrigidos com atualizações futuras.", 2
"O leitor de digitais na tela é um pouco lento em comparação com outros modelos do mercado.", 2
"O preço é muito alto em comparação com outros modelos com configurações semelhantes, não oferecendo um bom custo-benefício.", 1
"Câmera com modo Pro para controle manual de ISO, abertura e velocidade do obturador.",5
"Desempenho com processador otimizado para tarefas de inteligência artificial.",4
"Bateria com gerenciamento inteligente de energia para maior duração.",4
"Tela com baixa emissão de luz azul certificada para conforto visual.",4
"Design resistente a impressões digitais e manchas.",4
"Ótimo custo-benefício para quem busca um celular completo.",4
"Câmera com dificuldade em fotos macro com muitos detalhes.",3
"Desempenho apresenta lentidão com muitos aplicativos abertos em segundo plano.",3
"Bateria demora para carregar mesmo com carregador potente.",3
"Tela com reflexos excessivos em ambientes externos.",2
"Design com pouca variedade de cores e acabamentos.",3
"Preço elevado considerando a ausência de alguns recursos.",2
"Câmera com gravação de vídeo em 4K a 60fps.",4
"Desempenho fluido para edição de fotos e vídeos leves.",4
"Bateria com suporte a carregamento reverso cabeado.",4
"Tela com bom nível de brilho para uso em ambientes internos.",4
"Design compacto e leve, ideal para uso com uma mão.",4
"Bom celular para o dia a dia, atende às necessidades básicas.",3
"Câmera com alcance dinâmico limitado em fotos com alto contraste.",3
"Desempenho apresenta aquecimento em jogos mais exigentes.",3
"Bateria com autonomia abaixo da média para uso intenso.",2
"Tela com baixa taxa de contraste, cores pouco vibrantes.",2
"Design com materiais que aparentam ser pouco duráveis.",2
"Preço não justifica os recursos oferecidos, existem opções melhores.",1
"Câmera com modo noturno aprimorado com IA.",5
"Desempenho com processador topo de linha para alta performance.",5
"Bateria com tecnologia de carregamento adaptável.",5
"Tela com taxa de atualização variável para economia de energia.",5
"Design com certificação militar de resistência a impactos.",5
"Excelente celular para quem busca o melhor em tecnologia.",5
"Câmera com zoom espacial de até 100x.",4
"Desempenho com sistema de arrefecimento a vapor.",4
"Bateria com suporte a carregamento sem fio reverso rápido.",4
"Tela com tecnologia LTPO para maior eficiência energética.",4
"Design com acabamento em materiais sustentáveis.",4
"Celular inovador com recursos únicos.",5
"Câmera com sensor principal de alta resolução.",4
"Desempenho com foco em jogos mobile.",4
"Bateria com autonomia para longas jornadas.",4
"Tela com alta resolução e densidade de pixels.",4
"Design com visual moderno e minimalista.",4
"Ótimo celular para quem busca um bom desempenho em jogos.",4
"Câmera com dificuldade em fotos com pouca luz e movimento.",2
"Desempenho apresenta lentidão em tarefas mais complexas.",3
"Tela com problemas de touch screen em algumas áreas.",2
"Design com acabamento que risca com facilidade.",2
"Preço muito alto para o que oferece, não vale a pena.",1
"Câmera com modo vídeo profissional com diversos recursos.",5
"Desempenho com foco em produtividade e multitarefas.",5
"Bateria com carregamento rápido e sem fio reverso.",5
"Tela com tecnologia de proteção ocular contra luz azul.",5
"Design com construção premium e resistente a água e poeira.",5
"Celular completo para usuários exigentes.",5
"Câmera com estabilização óptica de imagem em vídeo.",4
"Desempenho com bom equilíbrio entre performance e consumo de energia.",4
"Bateria com autonomia satisfatória para o uso diário.",4
"Tela com cores precisas e bom contraste.",4
"Design ergonômico e confortável para uso prolongado.",4
"Bom celular para quem busca um aparelho confiável.",4
"Câmera com dificuldade em fotos com zoom digital.",3
"Desempenho apresenta aquecimento em uso intenso.",3
"Bateria com tempo de recarga acima da média.",3
"Tela com baixo brilho em ambientes externos com muita luz.",2
"Design com pouca inovação em relação a modelos anteriores.",3
"Preço elevado para os recursos oferecidos em comparação com a concorrência.",2
"Câmera com modo de fotografia noturna aprimorado por IA.",5
"Desempenho com processador de última geração para alta performance em jogos.",5
"Bateria com sistema de carregamento inteligente que otimiza a vida útil.",5
"Tela com tecnologia AMOLED com taxa de atualização adaptável de até 120Hz.",5
"Design com acabamento em materiais premium como cerâmica e titânio.",5
"Celular com recursos inovadores e design diferenciado.",5
