review,rating
"Material de ótima qualidade, mas um pouco pesado.",4
"O celular possui um bom sistema de segurança integrado.",3
"O celular possui um bom sistema de gerenciamento de aplicativos instalados, facilitando a organização.",3
"As atualizações de software são frequentes, mas nem sempre resolvem todos os bugs.",3
"O celular tem um sensor de batimentos cardíacos integrado.",3
"Veio com defeito. Tive que devolver!",1
"Excelente serviço, estou muito satisfeito porque o preço é justo.",5
"A qualidade de construção é muito baixa.",1
"O aparelho mantém a integridade dos dados durante o uso de aplicativos de armazenamento em nuvem, evitando perdas ou corrupções de arquivos importantes e garantindo a segurança das minhas informações armazenadas no celular, proporcionando tranquilidade ao utilizar serviços de nuvem para armazenar documentos, fotos e outros dados essenciais.",3
"O celular não conecta no bluetooth.",1
"Material de baixa qualidade, fiquei desapontado.",1
"A bateria do celular descarrega rapidamente, mesmo com uso mínimo e moderado, necessitando de recargas frequentes.",1
"Recebo muitas mensagens de erro, o que é frustrante.",1
"A conectividade 4G funciona conforme esperado.",3
"A câmera frontal não é boa para selfies em ambientes internos.",3
"O atendimento foi bom, mas o produto não impressionou.",3
"Recebi um item diferente do que pedi, mas o atendimento resolveu o problema rapidamente.",4
"O aparelho é ótimo para produtividade, aplicativos rodam bem.",5
"O design é bonito, mas a funcionalidade é limitada.",2
"As cores da tela são vibrantes e os detalhes nítidos.",4
"Gostei muito porque o atendimento foi excepcional.",4
"O celular é resistente, já caiu várias vezes sem danos.",5
"O desempenho é razoável, nada fora do comum.",3
"A interface de configuração inicial é amigável e direta.",3
"O aparelho quebrou em menos de uma semana de uso.",1
"A função de backup falha frequentemente, perdendo meus dados.",1
"Produto incrível, superou minhas expectativas.",5
"Material resistente e durável, superou minhas expectativas.",5
"É um celular ótimo para quem precisa de muita bateria.",4
"Funciona perfeitamente para redes sociais e aplicativos básicos.",5
"Gostei bastante, mas poderia ter mais funcionalidades.",4
"A gravação de vídeos em 4K oferece imagens nítidas e com boa estabilização.",4
"O aparelho esquenta muito ao usar aplicativos pesados.",3
"A função de backup local é fácil de acessar e configurar, proporcionando segurança para os dados.",3
"A tela é super nítida e os vídeos ficam incríveis.",5
"O preço é competitivo, levando em conta a marca e o desempenho.",4
"Não gostei da vibração, achei muito fraca.",3
"O celular possui recursos avançados que facilitam o dia a dia.",5
"O celular cumpre sua função, mas a qualidade deixa a desejar.",3
"A qualidade da tela para edição de fotos é adequada.",3
"Atendimento rápido, muito feliz com a compra.",5
"O carregamento rápido realmente faz a diferença no dia a dia.",5
"O aparelho possui um bom equilíbrio entre desempenho e consumo de energia, mantendo a bateria razoavelmente por bastante tempo.",3
"O aparelho frequentemente reinicia durante o uso.",1
"A função de atualização de aplicativos é automática e sem erros, sempre mantendo tudo atualizado.",5
"O celular mantém a integridade dos dados durante transferências importantes, mas pode haver pequenas perdas ocasionais.",3
"O desempenho em multitarefa é excelente, nunca trava.",5
"A interface de usuário facilita a navegação entre diferentes seções do aparelho, tornando o uso mais intuitivo e agradável.",3
"O aparelho é compatível com alguns acessórios, mas não com todos os disponíveis no mercado.",2
"Não gostei do tamanho, é muito grande para caber no bolso.",2
"A qualidade das transmissões de vídeo ao vivo é aceitável, mas pode haver pequenas falhas.",2
"O aparelho mantém a integridade das configurações personalizadas após atualizações de software.",5
"O celular mantém a integridade dos dados durante transferências de arquivos.",5
"O celular esquenta muito durante o carregamento rápido.",3
"O celular não consegue manter a conexão Bluetooth durante o uso intenso e prolongado, prejudicando a conectividade com outros dispositivos essenciais.",1
"O design sem bordas é lindo, mas exige mais cuidado no manuseio.",5
"Um celular que me acompanha em todas as minhas atividades.",5
"Recebi com um detalhe na pintura, mas não afeta o uso.",3
"O celular lida bem com a execução de múltiplos aplicativos de mídia simultaneamente, sem apresentar lentidão ou travamentos.",3
"Comparado a outros produtos do mesmo valor, compensa.",3
"O aparelho possui um sistema de gerenciamento de notificações prioritárias eficiente.",4
"A sincronização com outros dispositivos falha constantemente.",1
"O celular me acompanha em todos os momentos.",4
"A função de busca por aplicativos instalados é rápida e eficiente, facilitando o acesso aos aplicativos desejados sem necessidade de navegar por diversas telas ou menus.",3
"A personalização de temas é vasta e variada.",4
"Não recomendo, o produto não funciona como prometido.",1
"A funcionalidade de gerenciamento de energia prolonga a vida útil da bateria.",3
"Meu telefone foi roubado e comprei esse temporariamente, mas gostei tanto que vou continuar usando!",5
"Veio com um arranhão, mas nada que prejudique o uso.",3
"A bateria não dura o suficiente para o uso diário.",2
"A qualidade das chamadas de vídeo é satisfatória para conversas casuais.",3
"O celular mantém a estabilidade durante o uso de aplicativos de streaming de música por longos períodos.",3
"A qualidade do vídeo é incrível, parece profissional.",5
"O sistema operacional é muito lento.",1
"O aparelho é resistente, mas a traseira risca facilmente.",3
"Entrega rápida e produto acima da média.",5
"Os aplicativos abrem rapidamente, sem travamentos.",5
"Chegou antes do prazo e está funcionando perfeitamente.",5
"A bateria dura tranquilamente um dia inteiro de uso moderado.",4
"A interface do usuário é cheia de bugs que impedem o funcionamento correto de várias funcionalidades essenciais.",1
"A funcionalidade de multitarefa é excelente, nunca travou.",5
"O celular não acompanha fones de ouvido na caixa.",2
"O celular não consegue manter a sincronização com serviços de nuvem de forma estável e eficiente, resultando em perda de dados importantes e insatisfação do usuário.",1
"A bateria do celular descarrega rapidamente, mesmo com uso mínimo e moderado, necessitando de recargas frequentes e inconvenientes para o usuário.",1
"Os aplicativos pré-instalados ocupam muito espaço.",3
"Nunca gostei dessa marca, mas resolvi dar uma chance. Decepcionante!",1
"O celular não suporta a troca de idiomas sem travamentos frequentes e reinicializações inesperadas, limitando o uso para usuários internacionais ou multilíngues e causando frustração.",1
"O aparelho é bonito, mas os acessórios são de baixa qualidade.",3
"A funcionalidade de backup automático protege meus dados de forma eficiente, sem necessidade de intervenção manual frequente.",3
"O produto veio diferente do anunciado, fiquei desapontado.",1
"Não consigo usar dois chips ao mesmo tempo.",2
"Funciona bem para o básico, mas falta inovação.",3
"Chegou danificado, tive que devolver.",1
"O celular possui um bom sistema de notificações de atualizações e novidades de aplicativos, mantendo-me informado sobre as últimas funcionalidades.",3
"Produto ruim demais, me arrependi muito.",2
"O sistema operacional é intuitivo, embora às vezes apresente pequenos atrasos.",4
"O celular mantém a conectividade estável durante uso intenso de dados.",3
"O celular tem alto-falantes estéreo com som imersivo.",4
"O aparelho suporta bem a execução de aplicativos de comunicação sem interrupções.",3
"É robusto e resistente, perfeito para o meu uso.",5
"A bateria do celular não carrega completamente.",1
"A qualidade do material é muito baixa.",1
"A bateria oferece uma excelente autonomia, durando até dois dias com uso moderado.",4
"O aparelho possui um bom equilíbrio entre recursos avançados e usabilidade.",3
"Entrega rápida, mas a embalagem veio com avarias.",2
"O aparelho mantém a integridade dos dados sem falhas.",3
"O celular não consegue manter a sincronização com meu computador de forma estável.",1
"Gostei muito, atende exatamente às minhas necessidades.",5
"A funcionalidade de backup na nuvem é automática e protege meus dados de forma eficiente.",5
"A integração com aplicativos de produtividade funciona perfeitamente.",4
"Experiência ruim, totalmente frustrante.",2
"Muito difícil de sincronizar com outros dispositivos.",2
"Entrega rápida e embalagem impecável, adorei.",5
"A entrega demorou mais do que o previsto.",1
"O aparelho não suporta carregamento rápido em 30W, como anunciado.",3
"A câmera é horrível, fotos com baixa qualidade e muito ruído.",1
"A função de atualização de aplicativos é automática e funcional, mas pode demorar um pouco para completar.",3
"Em comparação com o modelo anterior, houve poucas melhorias.",2
"É excelente para assistir vídeos, a tela é muito imersiva.",5
"O aparelho apresenta lentidão ao alternar entre aplicativos.",1
"O aparelho suporta bem a execução de aplicativos de comunicação em tempo real sem interrupções.",5
"Configurar o aparelho foi relativamente fácil.",3
"O aparelho não suporta a personalização de configurações avançadas sem travamentos frequentes e reinicializações inesperadas, limitando a experiência do usuário.",1
"O aparelho não suporta a instalação de novos aplicativos sem erros constantes.",1
"Veio com um defeito, mas o suporte foi rápido em resolver.",4
"Entrega rápida, mas o produto não é tão bom quanto esperava.",2
"Bom para quem busca um celular com boa autonomia de bateria.",4
"Produto rápido, adorei!",5
"A bateria demora para carregar, mesmo com o carregador rápido.",3
"Produto básico, mas quebra um bom galho.",4
"O produto é excelente, mas o preço poderia ser mais competitivo.",4
"O telefone esquenta muito durante o carregamento.",2
"A tela de 120Hz é super fluida, especialmente para jogos.",5
"O celular possui um bom sistema de gerenciamento de espaço de armazenamento interno.",3
"O suporte ao cliente não resolveu meus problemas.",1
"Demorou para chegar, mas funciona bem.",4
"Cumpre o que promete, mas não surpreende.",3
"A atualização do sistema demora muito para chegar.",2
"A tela AMOLED é vibrante e de alta resolução.",5
"Tudo ruim: design, usabilidade e aplicativos.",1
"Os sensores respondem rapidamente, é muito preciso.",5
"A função de busca por arquivos e documentos no dispositivo é rápida e eficiente na maior parte do tempo.",3
"Experiência horrível, totalmente frustrante.",1
"O som dos alto-falantes é claro e potente.",5
"Preço bom e qualidade boa no geral!",4
"Um celular inovador e com tecnologia de ponta.",5
"A tela tátil responde bem, mas pode apresentar pequenos atrasos em toques rápidos.",3
"O aparelho suporta bem a execução de aplicativos de produtividade intensiva sem problemas de desempenho.",4
"Poderiam ter caprichado mais na qualidade, mas tava barato, então tudo bem!",2
"A qualidade das transmissões de vídeo ao vivo é excelente, sem atrasos.",5
"A qualidade da reprodução de vídeos em alta definição é satisfatória.",3
"Infelizmente, este celular não atendeu às minhas necessidades.",2
"O som dos alto-falantes é muito fraco.",1
"Atendeu ao que prometeu, mas não mais que isso.",2
"Entrega cara, nunca mais compro dessa loja.",1
"O celular tem bordas muito finas, o que aumenta a imersão.",5
"O aparelho suporta bem a execução de aplicativos de edição de fotos sem lentidão.",3
"A função de backup local é fácil de acessar e configurar, permitindo que eu proteja meus dados de forma conveniente.",3
"Material é razoável, mas o design compensa.",4
"A interface de usuário é responsiva, sem atrasos perceptíveis ao navegar entre aplicativos.",3
"O celular excedeu todas as minhas expectativas, é simplesmente perfeito.",5
"Bom demais! Uso pra ouvir músicas na academia e também pra assistir vídeos.",4
"O celular veio com um defeito de fábrica e precisei acionar a garantia.",1
"Sensacional! Qualidade e velocidade impressionante!",5
"A qualidade da tela para assistir a vídeos em diferentes plataformas é satisfatória, proporcionando uma boa experiência visual independentemente do aplicativo utilizado.",3
"A personalização das configurações é ampla e fácil de ajustar conforme minha preferência.",5
"Superou minhas expectativas em termos de qualidade.",5
"O desempenho do dispositivo é excelente, recomendo muito.",5
"A cor veio diferente do que eu comprei no site, mas fora isso tudo bem!",3
"A interface do celular é extremamente lenta para responder aos toques.",1
"O manual é confuso, mas o suporte foi eficiente.",4
"A qualidade da reprodução de vídeos em plataformas de streaming é satisfatória.",3
"O celular oferece suporte a carregamento rápido e sem fio.",4
"O celular veio com uma película protetora de tela aplicada de fábrica.",4
"O aparelho trava ao usar redes sociais por mais de 10 minutos.",1
"Decepcionante, não veio com todos os acessórios prometidos.",1
"O celular mantém a conectividade estável durante o uso de aplicativos de música, proporcionando uma experiência auditiva contínua e sem interrupções mesmo durante o uso prolongado.",3
"Material de alta qualidade, me surpreendeu positivamente.",5
"O celular se conecta facilmente a dispositivos de áudio externos.",3
"O carregamento sem fio não é tão rápido quanto esperava.",3
"Funciona adequadamente, mas nada impressionante.",2
"A bateria do celular não dura o suficiente para um dia completo de uso.",1
"O aparelho possui um bom equilíbrio entre desempenho e consumo de energia, prolongando a duração da bateria sem comprometer a performance.",3
"Não funcionou corretamente, tive problemas desde o início.",2
"Nunca chegou na minha casa! Esperando até hoje!",1
"Funcionalidades avançadas que facilitam meu dia a dia.",4
"O celular é perfeito para quem busca o máximo em tecnologia e inovação.",5
"Não gostei da qualidade do cabo USB que acompanha o celular.",2
"O aparelho suporta bem a execução de aplicativos de comunicação em tempo real.",3
"Horrível, não atendeu às expectativas.",1
"Atendimento horrível, não recomendo de jeito nenhum.",2
"Produto atende bem para tarefas simples, mas não para profissionais.",3
"É um celular bom, mas nada de excepcional.",3
"A tela apresenta lag quando toco rapidamente, dificultando o uso.",1
"Um celular que me proporciona momentos incríveis.",5
"A interface de usuário facilita a organização de aplicativos e pastas.",3
"A interface do celular não é amigável para usuários iniciantes.",1
"O GPS nunca funciona corretamente, sempre me leva para o lugar errado.",1
"A duração da bateria me surpreendeu, dura o dia inteiro.",5
"A bateria do celular não mantém a carga por mais de algumas horas.",1
"O celular é bonito, mas os acessórios que acompanham são simples.",4
"A qualidade da tela para assistir a vídeos em diferentes plataformas é excepcional, muito nítida.",5
"As fotos noturnas são escuras e com muito ruído.",1
"Material de qualidade e ótima usabilidade, recomendo.",5
"O acabamento é impecável.",4
"O celular não consegue executar jogos sem travar ou desacelerar significativamente.",1
"O sistema de reconhecimento facial não funciona bem no escuro.",3
"É ótimo para estudantes, muito eficiente para tarefas simples.",5
"A qualidade das transmissões de áudio em plataformas de comunicação é clara e sem falhas técnicas.",5
"É um celular ideal para quem tira muitas fotos e grava vídeos.",4
"A câmera possui zoom óptico de alta qualidade.",5
"Foi uma experiência ótima, uma das melhores compras.",5
"Funciona bem, mas achei o preço um pouco alto.",3
"O telefone não recebeu atualizações de segurança recentes.",2
"Excelente relação custo-benefício.",5
"A qualidade das transmissões de vídeo em chamadas de vídeo é boa, mas pode apresentar pequenas falhas de conexão.",2
"O aparelho desliga sozinho sem motivo.",1
"O celular reiniciou sozinho algumas vezes, sem motivo aparente.",1
"A câmera tira fotos excelentes, embora a qualidade em baixa iluminação possa melhorar.",4
"A qualidade da câmera em fotos com movimento é aceitável.",3
"O aparelho possui um bom equilíbrio entre desempenho e consumo de energia.",3
"Design moderno e funcional, gostei muito.",5
"A durabilidade é questionável, mas o desempenho é bom.",3
"Atendimento ruim, não voltarei a comprar.",2
"Em geral é muito bom, mas tem pouco espaço de armazenamento.",3
"O dispositivo não funcionou como esperado desde o início.",1
"O celular possui um bom sistema de gerenciamento de aplicativos instalados.",5
"Chegou com um leve arranhão, mas ainda funciona muito bem.",4
"O celular possui um bom sistema de notificações de atualizações e novidades de aplicativos, mantendo-me informado sobre as últimas funcionalidades e melhorias disponíveis para os aplicativos que utilizo regularmente.",3
"Achei o preço justo pelo que o produto oferece.",4
"Serviço decepcionante, uma escolha terrível.",1
"A interface de usuário facilita a navegação entre diferentes seções do aparelho, tornando o uso mais intuitivo.",3
"Não gostei da posição do botão de volume, é desconfortável.",3
"O sistema operacional tem muitos recursos úteis.",5
"A tela risca com facilidade, mesmo com cuidado.",2
"Produto prático e versátil, ideal para várias situações.",5
"Recebi com atraso, mas o aparelho atendeu às minhas expectativas.",4
"O celular não suporta a troca de idiomas sem travamentos frequentes.",1
"O celular não consegue manter a sincronização com outros dispositivos.",1
"A interface do usuário permite fácil acesso às configurações principais.",3
"Ganhei de presente e uso como segundo celular. Parece bom!",3
"O celular suporta a reprodução de mídias em alta definição sem problemas.",4
"A personalização das configurações é possível, porém limitada.",2
"Chegou danificado e o suporte foi ineficiente.",1
"O produto não atende às especificações anunciadas.",1
"A qualidade das transmissões de vídeo ao vivo em plataformas de streaming é muito boa.",5
"Adorei o acabamento fosco, não deixa marcas de dedo.",5
"A função de bloqueio de tela é rápida e eficiente na proteção de dados.",3
"A sincronização com redes sociais é perfeita.",5
"A qualidade das fotos em movimento é bastante boa.",4
"Fácil de montar e usar, gostei muito.",5
"O celular superou minhas expectativas em todos os aspectos.",5
"O serviço ao cliente foi muito eficiente e amigável.",5
"A interface de usuário facilita a navegação entre diferentes seções do aparelho, mas não é muito personalizada.",3
"O aparelho é razoavelmente rápido, mas não tão eficiente quanto outros modelos.",2
"Enviaram para o endereço errado, mas depois de alguns dias chegou! Por enquanto estou gostando!",3
"O celular lida bem com a execução de aplicativos de produtividade sem travamentos.",3
"O celular é insuperável.",5
"A qualidade da câmera do celular é muito baixa em todas as condições de iluminação.",1
"Entrega dentro do prazo e produto bem embalado.",5
"O celular não consegue executar jogos sem travar ou ficar lento.",1
"O produto é excelente, uso todos os dias.",5
"Porcaria nem funciona direito!",1
"O produto chegou rápido e já está em uso, estou adorando.",5
"A funcionalidade de gerenciamento de notificações de aplicativos de jogos é eficiente.",3
"Recebi o modelo errado, mas o atendimento resolveu o problema rapidamente.",4
"Produto de baixa qualidade, muito decepcionado.",2
"O celular veio sem os acessórios inclusos na caixa.",1
"Excelente custo-benefício, estou muito satisfeito.",5
"A qualidade das transmissões de vídeo em chamadas de vídeo é muito boa.",4
"Entrega atrasada, mas o produto é excelente.",5
"Gostei muito porque o preço é justo.",5
"A qualidade do material dá uma sensação premium.",5
"O brilho da tela é ótimo para uso externo, mesmo sob luz solar direta.",4
"A qualidade é razoável, mas o preço é justo.",3
"Funciona bem, mas o desempenho é mediano.",3
"O aparelho possui um bom equilíbrio entre design moderno e funcionalidade prática para o dia a dia.",3
"O celular oferece um desempenho consistente ao longo do dia.",3
"A interface da câmera oferece algumas opções de configuração, mas são limitadas.",2
"O celular é leve e compacto, ideal para usar com uma mão.",4
"O aparelho mantém a integridade dos dados durante sincronizações com serviços de armazenamento externo, confiável na maior parte das vezes.",3
"O sistema de segurança é confiável, adorei o leitor de digitais.",5
"A funcionalidade de backup automático protege meus dados de forma eficiente.",4
"A sincronização com outros dispositivos é funcional, porém demora um pouco.",2
"Não gostei do brilho automático, às vezes fica muito escuro.",3
"Produto danificado, uma escolha terrível.",2
"O celular possui armazenamento expansível, o que é útil para quem precisa de mais espaço.",2
"Não funcionou como anunciado, experiência frustrante.",1
"A entrada do carregador apresentou defeito em pouco tempo de uso.",1
"Bateria esquenta muito! Não recomendo dar para criança usar!",2
"O celular não suporta a expansão de armazenamento externo de forma confiável.",1
"A câmera do celular não foca corretamente, resultando em fotos desfocadas e de baixa qualidade em todas as condições de iluminação.",1
"O aparelho possui um bom equilíbrio entre desempenho e eficiência energética.",4
"O celular veio com um carregador turbo, carrega muito rápido.",4
"A função de gravação de tela salva em ótima qualidade.",5
"As atualizações de software são problemáticas.",1
"O celular é lento, trava muito e a qualidade das fotos é péssima, não recomendo.",1
"Preço justo para a qualidade oferecida, recomendo.",4
"O celular não suporta a troca de idiomas sem travamentos frequentes e reinicializações inesperadas, limitando o uso internacional.",1
"O celular lida muito bem com a execução de aplicativos de produtividade sem apresentar nenhuma lentidão.",5
"O GPS é rápido e preciso, mesmo em áreas com sinal fraco.",5
"O celular é resistente a água e poeira, ideal para usar em qualquer ambiente.",4
"O celular oferece uma excelente relação custo-benefício.",5
"Horrível, a qualidade é muito baixa.",2
"A tela curva dá um toque premium, adorei.",5
"O aparelho não suporta a personalização de configurações básicas.",1
"A embalagem estava amassada, mas o produto funciona bem.",3
"O aparelho possui um bom equilíbrio entre desempenho e consumo de energia, prolongando a duração da bateria sem comprometer a performance geral do celular durante o uso diário.",3
"O touch screen não responde bem em alguns momentos, o que é frustrante.",2
"O design é funcional, mas não se destaca em termos de estética.",3
"Um celular que me proporciona uma experiência única.",5
"Não tenho muito o que comentar, não é nada especial.",3
"Tive uma experiência ruim porque não funcionou como esperado.",2
"A interface do sistema é bem limpa e fácil de usar.",5
"O sensor de proximidade não funciona bem, desliga a tela errado.",2
"A câmera traseira é excelente, mas falta estabilização em vídeos.",4
"A integração com aplicativos de produtividade é funcional, mas não muito fluida.",2
"O celular oferece algumas opções de personalização de temas e layouts, mas são limitadas.",2
"A interface do usuário é cheia de bugs e falhas.",1
"O celular suporta bem a transferência de arquivos via Bluetooth.",3
"O celular veio com a tela arranhada.",1
"A função de desbloqueio facial é muito rápida e eficiente.",4
"A funcionalidade de busca por aplicativos é rápida e eficiente.",3
"O desempenho é mediano, ideal para quem não exige muito.",3
"A função de busca no sistema é rápida e precisa.",3
"Os botões são bem localizados, muito fácil de usar.",5
"As chamadas são claras e sem nenhuma interferência.",5
"O software vem cheio de aplicativos desnecessários pré-instalados.",2
"A conectividade Bluetooth é estável e fácil de emparelhar.",4
"Funciona bem em redes Wi-Fi 6, conexão super estável.",5
"Um celular que me surpreendeu pela sua eficiência.",5
"A câmera traseira não capta detalhes como esperado.",2
"Os fones de ouvido não têm boa qualidade, prefiro usar outro modelo.",2
"Compacto e leve, ideal para o dia a dia.",4
"A qualidade das transmissões de vídeo ao vivo em plataformas de streaming é muito boa, sem grandes interrupções.",2
"O celular suporta a reprodução de mídias em alta definição, mas pode apresentar pequenos atrasos.",2
"O celular não consegue manter a conexão com redes sociais.",1
"O celular lida muito bem com a execução de múltiplos aplicativos de mídia simultaneamente.",5
"Extremamente leve e fino, quase nem sinto no bolso.",4
"O desempenho em multitarefa é excelente, transições fluidas entre aplicativos.",4
"A cor veio errada, mas o produto em si é bom.",3
"O design minimalista é muito elegante.",5
"O celular possui um bom sistema de gerenciamento de espaço de armazenamento.",3
"Gostei bastante, especialmente pela qualidade do material.",5
"O sistema operacional é intuitivo e fácil de usar.",5
"O aparelho mantém a integridade dos dados durante migrações de sistema.",3
"O celular não suporta a troca de idiomas sem reiniciar o aparelho.",1
"A qualidade das transmissões de áudio em plataformas de comunicação é clara e sem falhas técnicas.",4
"A conectividade Wi-Fi e Bluetooth é estável e rápida.",5
